;Rua;Bairro;Cidade;area_m2;quartos;banheiros;vagas;price
7275;Rua Olivério Pilar ; Vila Primavera; São Paulo ;200;3;3;6;R$ 600.000
7276;Rua Coronel Bento Noronha, 50 ; Jardim Paulistano; São Paulo ;934;5;8;7;R$ 14.000.000
7277;Cidade Jardim, São Paulo ; SP;;600;5;4;6;R$ 6.000.000
7278;Rua Magino Roberto de Oliveira ; Vila Independência; São Paulo ;100;3;2;2;R$ 420.000
7279;Rua Princesa Leopoldina ; Alto da Lapa; São Paulo ;140;2;2;4;R$ 1.250.000
7280;Jardim Leonor, São Paulo ; SP;;648;5;5;4;R$ 2.200.000
7281;Vila Monumento, São Paulo ; SP;;279;3;1;2;R$ 750.000
7282;Vila Vera, São Paulo ; SP;;220;3;1;2;R$ 650.000
7283;Rua Madalena de Morais, 3773;8888;;742;4;8;6;"R$ 9.800
                      /Mês"
7284;Caxingui, São Paulo ; SP;;230;3;3;4;R$ 1.800.000
7285;Rua Oliveira Lima ; Cambuci; São Paulo ;140;3;2;3;R$ 690.000
7286;Água Funda, São Paulo ; SP;;153;3;1;2;R$ 660.000
7287;Rua Maria Inácia da Conceição ; Vila Carrão; São Paulo ;500;4;5;5;R$ 1.200.000
7288;Avenida Itacira ; Planalto Paulista; São Paulo ;155;2;1;2;R$ 1.200.000
7289;Cidade Jardim, São Paulo ; SP;;500;3;6;4;R$ 5.000.000
7290;Rua Içana ; Jardim Paulistano; São Paulo ;350;3;2;2;R$ 2.800.000
7291;Bosque da Saúde, São Paulo ; SP;;160;4;1;2;R$ 799.000
7292;Avenida das Magnólias ; Cidade Jardim; São Paulo ;850;4;4;10;R$ 11.000.000
7293;Mirandópolis, São Paulo ; SP;;144;3;1;1;R$ 900.000
7294;Vila Romero, São Paulo ; SP;;348;3;4;4;R$ 1.000.000
7295;Rua Mário ; Vila Romana; São Paulo ;150;3;3;2;R$ 1.250.000
7296;Rua Suarão, , 96 ; Vila Prudente; São Paulo ;136;2;1;1;R$ 440.000
7297;Rua Consórcio ; Vila Nova Conceição; São Paulo ;271;1;3;4;"R$ 10.000
                      /Mês"
7298;Lapa, São Paulo ; SP;;200;2;2;2;"R$ 5.000
                      /Mês"
7299;Rua Chafic Ganem ; Vila das Mercês; São Paulo ;140;3;2;4;R$ 665.000
7300;Rua Arapixi ; Chácara Monte Alegre; São Paulo ;350;4;7;10;R$ 1.750.000
7301;Rua Almirante Pereira Guimarães, 000 ; Pacaembu; São Paulo ;457;4;2;7;R$ 2.200.000
7302;Rua Robélia ; Jardim Prudência; São Paulo ;632;5;7;6;R$ 3.000.000
7303;Vila Madalena, São Paulo ; SP;;519;4;4;3;R$ 2.450.000
7304;Liberdade, São Paulo ; SP;;150;3;2;2;R$ 1.040.000
7305;Rua Lourenço de Almeida Prado ; Vila Tramontano; São Paulo ;1200;6;7;8;R$ 9.000.000
7306;Vila Gumercindo, São Paulo ; SP;;250;3;1;2;R$ 1.380.000
7307;Rua Doutor Odon Carlos de Figueiredo Ferraz, 1054 ; Parque São Domingos; São Paulo ;305;4;6;5;R$ 1.350.000
7308;Rua Herval ; Belenzinho; São Paulo ;250;4;5;4;"R$ 15.000
                      /Mês"
7309;Rua Santos Dumont, 438 ; Jardim Petrópolis; São Paulo ;567;5;5;4;R$ 3.490.000
7310;Rua Arizona ; Cidade Monções; São Paulo ;180;3;5;5;R$ 1.300.000
7311;Avenida Santo Amaro ; Brooklin Paulista; São Paulo ;95;2;2;1;R$ 545.000
7312;Rua Joaquim Cândido de Azevedo Marques ; Vila Morumbi; São Paulo ;580;4;5;10;R$ 2.300.000
7313;Rua Doutor João Dalmácio Azevedo, 81 ; Cidade Jardim; São Paulo ;900;4;6;8;R$ 8.400.000
7314;Rua Antônio Cantarella ; Vila Santo Estéfano; São Paulo ;143;3;3;2;R$ 614.800
7315;Avenida Mahatma Gandhi ; Interlagos; São Paulo ;380;3;8;6;R$ 1.680.000
7316;Rua Gustavo da Silveira ; Vila Santa Catarina; São Paulo ;175;4;3;2;R$ 580.000
7317;Pacaembu, São Paulo ; SP;;400;2;1;4;R$ 2.150.000
7318;Rua Menaldo Rodrigues ; Jardim Luzitânia; São Paulo ;580;4;5;4;R$ 5.900.000
7319;Vila Monte Alegre, São Paulo ; SP;;172;3;1;2;R$ 1.590.000
7320;Rua Péricles ; Jardim Petrópolis; São Paulo ;652;3;6;3;"R$ 12.000
                      /Mês"
7321;Vila Caraguatá, São Paulo ; SP;;100;2;1;1;R$ 370.000
7322;Jardim da Saúde, São Paulo ; SP;;196;3;1;2;R$ 890.000
7323;Vila Brasílio Machado, São Paulo ; SP;;116;3;1;2;R$ 680.000
7324;Rua Brigadeiro Gama Barcelos ; Parque Jabaquara; São Paulo ;143;3;2;4;R$ 890.000
7325;Alameda dos Anapurus, 194 ; Indianópolis; São Paulo ;600;4;7;6;R$ 3.300.000
7326;Travessa Herval D'Oeste, 3 ; Rio Pequeno; São Paulo ;140;2;3;3;"R$ 2.990
                      /Mês"
7327;Rua Eliseu Visconti ; Paineiras do Morumbi; São Paulo ;744;4;7;4;"R$ 30.000
                      /Mês"
7328;Rua Professor Castro Soromenho ; Vila Congonhas; São Paulo ;112;2;3;2;R$ 850.000
7329;Cidade Jardim, São Paulo ; SP;;409;4;1;4;R$ 4.500.000
7330;Rua Florindo Braglia ; Jardim São Paulo(Zona Norte); São Paulo ;230;4;4;3;R$ 1.200.000
7331;Rua Piave ; Vila Inah; São Paulo ;380;3;4;6;R$ 1.900.000
7332;Rua Pau;Brasil;380;658;5;7;8;R$ 7.900.000
7333;Rua Sacadura Cabral ; Lapa; São Paulo ;37;1;2;1;R$ 510.000
7334;Rua Padre Vicente Heckel ; Parque Jabaquara; São Paulo ;274;3;2;6;R$ 939.000
7335;Parque Jabaquara, São Paulo ; SP;;193;3;3;4;R$ 950.000
7336;Jardim Luzitânia, São Paulo ; SP;;627;3;5;4;R$ 13.000.000
7337;Rua André Saraiva ; Vila Sônia; São Paulo ;125;2;2;2;R$ 689.000
7338;Vila Isa, São Paulo ; SP;;240;3;1;3;R$ 850.000
7339;Jardim Cordeiro, São Paulo ; SP;;640;5;7;7;R$ 6.000.000
7340;Vila Talarico, São Paulo ; SP;;168;3;3;2;R$ 450.000
7341;Rua Juvenal Galeno ; Jardim da Saúde; São Paulo ;270;4;4;2;R$ 890.000
7342;Rua Izabel Velho ; Vila São Vicente; São Paulo ;116;3;4;2;R$ 490.000
7343;Rua Professor Vahia de Abreu ; Vila Olímpia; São Paulo ;94;3;4;1;R$ 1.200.000
7344;Rua Rosalino Silva ; Jardim Itapeva; São Paulo ;129;3;3;3;R$ 620.000
7345;Rua Canudos ; Jardim da Glória; São Paulo ;230;3;2;3;R$ 1.200.000
7346;Rua Canudos ; Jardim da Glória; São Paulo ;229;3;2;3;R$ 1.199.999
7347;Rua Auguste Clesinger, , 172 ; Vila do Bosque; São Paulo ;273;5;5;3;R$ 1.270.000
7348;Jardim Peri, São Paulo ; SP;;330;3;2;3;R$ 1.250.000
7349;Rua Marcondes de Andrade ; Vila São José (Ipiranga); São Paulo ;177;3;2;3;R$ 980.000
7350;Rua Doutor Monteiro Tapajós ; Vila Santo Estéfano; São Paulo ;121;3;2;2;R$ 590.000
7351;Rua Sônia Ribeiro ; Campo Belo; São Paulo ;250;4;4;4;R$ 1.750.000
7352;Campo Belo, São Paulo ; SP;;214;4;5;4;R$ 2.500.000
7353;Rua Guaxatuba ; Santo Amaro; São Paulo ;202;2;1;4;R$ 1.000.000
7354;Rua Honduras ; Jardim Paulista; São Paulo ;360;4;6;8;R$ 7.497.000
7355;Saúde, São Paulo ; SP;;165;4;4;2;R$ 1.249.000
7356;Rua Primavera ; Jardim Paulista; São Paulo ;350;3;3;4;"R$ 25.000
                      /Mês"
7357;Rua Mendes Pais ; Vila Nova Conceição; São Paulo ;564;3;5;3;R$ 8.500.000
7358;Travessa Professor Dalmo Belfort de Mattos ; Jardim Miriam; São Paulo ;67;2;1;1;R$ 257.600
7359;Largo São Rafael ; Mooca; São Paulo ;103;3;2;2;R$ 750.000
7360;Vila Dom Pedro I, São Paulo ; SP;;225;4;1;5;R$ 1.390.000
7361;Vila Vera, São Paulo ; SP;;146;3;1;1;R$ 480.000
7362;Sumaré, São Paulo ; SP;;160;8;3;5;"R$ 8.500
                      /Mês"
7363;Avenida Manoel dos Reis Araújo ; Jardim Marajoara; São Paulo ;500;3;6;6;R$ 2.300.000
7364;Santo Amaro, São Paulo ; SP;;185;4;5;4;R$ 2.100.000
7365;Vila Monumento, São Paulo ; SP;;282;4;2;4;R$ 1.705.000
7366;Vila Brasílio Machado, São Paulo ; SP;;110;3;3;2;R$ 650.000
7367;Rua Roger Chaffee ; Interlagos; São Paulo ;345;4;6;4;R$ 2.500.000
7368;Rua Giácomo Carissimi, 178 ; Vila Adalgisa; São Paulo ;120;3;2;2;R$ 580.000
7369;Rua Xavier da Rocha ; Parque da Vila Prudente; São Paulo ;96;2;1;2;R$ 470.000
7370;Bosque da Saúde, São Paulo ; SP;;486;3;1;1;R$ 1.900.000
7371;Parque Jabaquara, São Paulo ; SP;;150;3;1;2;R$ 1.250.000
7372;Jardim D'Abril, São Paulo ; SP;;90;2;1;1;R$ 349.800
7373;Rua Gastão da Cunha, 324 ; Vila Paulista; São Paulo ;177;3;2;2;R$ 690.000
7374;Rua Comandante Ismael Guilherme ; Jardim Luzitânia; São Paulo ;600;4;7;4;R$ 12.000.000
7375;Santo Amaro, São Paulo ; SP;;350;4;6;10;R$ 2.300.000
7376;Rua Salvador Fiordelisio, 160 ; Vila Bertioga; São Paulo ;77;3;4;2;R$ 599.000
7377;Paraisópolis, São Paulo ; SP;;828;1;1;3;R$ 841.750
7378;Rua Oronzo Scattone ; Vila Gumercindo; São Paulo ;70;2;1;1;R$ 495.000
7379;Rua Luís da Silva Araújo, 94 ; Jardim Leonor Mendes de Barros; São Paulo ;287;4;6;6;R$ 1.090.000
7380;Rua Mário Gonçalves de Oliveira ; Fazenda Morumbi; São Paulo ;750;4;7;5;"R$ 15.000
                      /Mês"
7381;Alto de Pinheiros, São Paulo ; SP;;280;4;6;4;"R$ 14.500
                      /Mês"
7382;Bosque da Saúde, São Paulo ; SP;;120;2;2;1;R$ 670.000
7383;Rua Marechal Bina Machado ; Jardim Marajoara; São Paulo ;271;4;5;4;R$ 1.800.000
7384;Avenida Amarilis, 933 ; Cidade Jardim; São Paulo ;840;4;6;8;R$ 5.900.000
7385;Rua Marechal Bina Machado ; Jardim Marajoara; São Paulo ;450;3;2;4;R$ 2.500.000
7386;Rua Getúlio Vargas Filho ; Cidade Vargas; São Paulo ;130;3;2;4;R$ 850.000
7387;Rua Miranda Guerra ; Jardim Petrópolis; São Paulo ;500;4;12;5;R$ 3.000.000
7388;Brooklin Paulista, São Paulo ; SP;;180;3;3;2;R$ 1.200.000
7389;Morumbi, São Paulo ; SP;;400;4;1;4;R$ 1.600.000
7390;Avenida Manoel dos Reis Araújo ; Jardim Marajoara; São Paulo ;266;3;4;6;R$ 1.400.000
7391;Rua Aziz Nader ; Jardim Petrópolis; São Paulo ;700;4;3;5;"R$ 16.000
                      /Mês"
7392;Rua Veríssimo da Silva, 0 ; Jardim Nossa Senhora do Carmo; São Paulo ;97;2;3;2;R$ 385.000
7393;Cidade Ademar, São Paulo ; SP;;220;3;3;6;R$ 420.000
7394;Fazenda Morumbi, São Paulo ; SP;;393;4;1;3;R$ 2.800.000
7395;Rua Marcos Fernandes, 489 ; Jardim da Saúde; São Paulo ;168;3;4;4;R$ 960.000
7396;Jardim Europa, São Paulo ; SP;;650;5;8;6;"R$ 45.000
                      /Mês"
7397;Saúde, São Paulo ; SP;;143;4;1;5;R$ 2.940.000
7398;Nova Piraju, São Paulo ; SP;;200;3;2;2;R$ 950.000
7399;Praça Contendas ; Vila Anhangüera; São Paulo ;96;2;2;3;R$ 850.000
7400;Avenida Manoel dos Reis Araújo ; Jardim Marajoara; São Paulo ;387;3;5;4;R$ 1.800.000
7401;Rua Amandaba ; Jardim Prudência; São Paulo ;300;3;4;3;R$ 1.500.000
7402;Cidade Jardim, São Paulo ; SP;;600;4;4;4;"R$ 15.000
                      /Mês"
7403;Rua Arandu ; Itaim Bibi; São Paulo ;87;1;2;2;R$ 900.000
7404;Rua Itamonte ; Vila Medeiros; São Paulo ;241;2;2;1;R$ 500.000
7405;Jardim América, São Paulo ; SP;;601;3;5;10;"R$ 80.000
                      /Mês"
7406;Rua General Calado, 192 ; Vila Regente Feijó; São Paulo ;194;4;4;2;R$ 900.000
7407;Rua Feliciano Maia ; Jardim Paulista; São Paulo ;600;5;4;10;"R$ 30.000
                      /Mês"
7408;Rua João Batista Leme da Silva ; Vila Madalena; São Paulo ;190;3;2;2;R$ 1.045.000
7409;Rua Senador Otávio Mangabeira ; Jardim Morumbi; São Paulo ;350;5;6;5;R$ 2.000.000
7410;Rua Piatá ; Vila Isolina Mazzei; São Paulo ;55;3;1;1;R$ 345.000
7411;Rua Sílvia Celeste de Campos ; Alto de Pinheiros; São Paulo ;670;5;6;7;R$ 15.000.000
7412;Rua Amélia Barsotti Simi ; Jardim Riviera; São Paulo ;400;3;3;7;R$ 1.480.000
7413;Rua Veneza ; Jardim Paulista; São Paulo ;450;3;1;2;"R$ 15.000
                      /Mês"
7414;Rua Doutor Dolzani ; Jardim da Glória; São Paulo ;106;2;2;1;R$ 448.970
7415;Vila Santa Catarina, São Paulo ; SP;;244;3;1;3;R$ 900.000
7416;Rua Tebas ; Jardim Brasil (Zona Sul); São Paulo ;400;3;6;6;R$ 2.800.000
7417;Rua Mesquita ; Vila Deodoro; São Paulo ;200;3;1;2;R$ 3.800.000
7418;Rua Doutor Queirós Guimarães ; Jardim Guedala; São Paulo ;400;4;5;4;R$ 3.850.000
7419;Jardim Prudência, São Paulo ; SP;;364;3;3;3;R$ 1.500.000
7420;Santo Amaro, São Paulo ; SP;;150;2;3;1;R$ 1.050.000
7421;Rua Fujie Nitta ; Brooklin Paulista; São Paulo ;147;3;3;2;R$ 970.000
7422;Jardim Paulista, São Paulo ; SP;;600;4;6;3;R$ 11.000.000
7423;Rua Ferdinando Laboriau ; Pacaembu; São Paulo ;450;4;4;4;R$ 2.350.000
7424;Pacaembu, São Paulo ; SP;;280;4;6;6;R$ 2.100.000
7425;Rua Sacadura Cabral ; Lapa; São Paulo ;37;1;2;1;R$ 510.000
7426;Rua Padre Vicente Heckel ; Parque Jabaquara; São Paulo ;274;3;2;6;R$ 939.000
7427;Parque Jabaquara, São Paulo ; SP;;193;3;3;4;R$ 950.000
7428;Jardim Luzitânia, São Paulo ; SP;;627;3;5;4;R$ 13.000.000
7429;Rua André Saraiva ; Vila Sônia; São Paulo ;125;2;2;2;R$ 689.000
7430;Vila Isa, São Paulo ; SP;;240;3;1;3;R$ 850.000
7431;Jardim Cordeiro, São Paulo ; SP;;640;5;7;7;R$ 6.000.000
7432;Vila Talarico, São Paulo ; SP;;168;3;3;2;R$ 450.000
7433;Rua Juvenal Galeno ; Jardim da Saúde; São Paulo ;270;4;4;2;R$ 890.000
7434;Rua Izabel Velho ; Vila São Vicente; São Paulo ;116;3;4;2;R$ 490.000
7435;Rua Professor Vahia de Abreu ; Vila Olímpia; São Paulo ;94;3;4;1;R$ 1.200.000
7436;Rua Rosalino Silva ; Jardim Itapeva; São Paulo ;129;3;3;3;R$ 620.000
7437;Rua Canudos ; Jardim da Glória; São Paulo ;230;3;2;3;R$ 1.200.000
7438;Rua Canudos ; Jardim da Glória; São Paulo ;229;3;2;3;R$ 1.199.999
7439;Rua Auguste Clesinger, , 172 ; Vila do Bosque; São Paulo ;273;5;5;3;R$ 1.270.000
7440;Jardim Peri, São Paulo ; SP;;330;3;2;3;R$ 1.250.000
7441;Jardim Guedala, São Paulo ; SP;;572;4;6;7;"R$ 15.000
                      /Dia"
7442;Rua Padre Madureira ; Jardim Guedala; São Paulo ;808;4;4;8;R$ 4.200.000
7443;Rua Luiz Galhanone, 404 ; Jardim Viana; São Paulo ;280;4;5;3;R$ 2.500.000
7444;Rua Geórgia ; Brooklin Paulista; São Paulo ;250;3;3;3;R$ 1.850.000
7445;Vila Progredior, São Paulo ; SP;;200;3;2;2;R$ 2.200.000
7446;Travessa Umberto Bignardi ; Paraíso; São Paulo ;190;11;8;2;R$ 2.500.000
7447;Vila Monumento, São Paulo ; SP;;95;2;2;2;R$ 750.000
7448;Vila Madalena, São Paulo ; SP;;320;3;4;4;R$ 1.980.000
7449;Jardim da Glória, São Paulo ; SP;;750;6;9;6;R$ 2.880.000
7450;Morumbi, São Paulo ; SP;;184;1;1;1;R$ 827.739
7451;Rua Cardoso de Almeida ; Perdizes; São Paulo ;350;5;4;5;"R$ 7.000
                      /Mês"
7452;Cambuci, São Paulo ; SP;;366;4;5;5;R$ 1.650.000
7453;Rua Ministro Oscar Saraiva ; Vila Brasílio Machado; São Paulo ;160;3;2;2;R$ 700.000
7454;Rua Wagih Assad Abdalla ; Morumbi; São Paulo ;520;5;9;6;R$ 4.800.000
7455;Rua Gaurama ; Jardim Franca; São Paulo ;450;5;6;5;R$ 2.200.000
7456;Rua Luís Góis ; Mirandópolis; São Paulo ;197;2;1;1;R$ 1.600.000
7457;Rua Antônio Barletta, 62 ; Vila Madalena; São Paulo ;280;4;1;5;"R$ 8.000
                      /Mês"
7458;City América, São Paulo ; SP;;573;5;6;8;R$ 2.015.000
7459;Vila Bancária Munhoz, São Paulo ; SP;;140;3;1;2;R$ 580.000
7460;Rua Acuruá ; Vila Romana; São Paulo ;290;4;3;2;R$ 2.200.000
7461;Rua Cristiano Viana ; Cerqueira César; São Paulo ;120;2;2;1;R$ 880.000
7462;Rua Viena ; Sacomã; São Paulo ;127;3;2;2;R$ 880.000
7463;Cidade Monções, São Paulo ; SP;;130;2;4;1;R$ 950.000
7464;Rua Conde de Porto Alegre ; Campo Belo; São Paulo ;381;3;3;3;R$ 1.900.000
7465;Rua dos Beija;Flores;74;300;2;2;2;R$ 770.000
7466;Jardim Londrina, São Paulo ; SP;;175;4;4;2;R$ 850.000
7467;Chácara Monte Alegre, São Paulo ; SP;;333;5;1;2;R$ 1.400.000
7468;Vila Ester (Zona Norte), São Paulo ; SP;;226;3;3;4;R$ 670.000
7469;Rua São José ; Santo Amaro; São Paulo ;800;4;5;12;R$ 8.200.000
7470;Pinheiros, São Paulo ; SP;;140;2;3;1;R$ 1.915.000
7471;Rua Professor Henrique Neves Lefevre ; Jardim Petrópolis; São Paulo ;947;4;5;10;R$ 9.000.000
7472;Indianópolis, São Paulo ; SP;;200;4;4;1;R$ 3.405.000
7473;Jardim Hípico, São Paulo ; SP;;133;2;4;3;R$ 1.750.000
7474;Campo Belo, São Paulo ; SP;;210;4;4;2;R$ 1.190.000
7475;Rua Alabastro ; Aclimação; São Paulo ;240;3;4;3;R$ 1.550.000
7476;Vila Lageado, São Paulo ; SP;;150;2;2;4;R$ 745.000
7477;Cambuci, São Paulo ; SP;;96;3;4;2;R$ 800.000
7478;Rua Antônio La Giudice ; Jardim Aricanduva; São Paulo ;125;2;1;2;R$ 330.000
7479;Rua Madalena de Morais ; Jardim Leonor; São Paulo ;726;4;8;9;R$ 4.500.000
7480;Vila Brasilina, São Paulo ; SP;;141;3;1;2;R$ 700.000
7481;Rua Agostinho Nunes de Abreu ; Catumbi; São Paulo ;126;2;1;2;R$ 394.550
7482;Rua Amélia Barsotti Simi ; Praia Azul; São Paulo ;225;3;4;6;R$ 1.170.000
7483;Vila Anhangüera, São Paulo ; SP;;118;3;2;2;R$ 750.000
7484;Rua Carlos Rath ; Alto de Pinheiros; São Paulo ;283;4;3;5;"R$ 8.000
                      /Mês"
7485;Rua João de Santa Maria ; Vila Brasilina; São Paulo ;184;3;6;3;R$ 1.280.000
7486;Rua Boa Esperança do Sul ; Jardim Guedala; São Paulo ;406;4;1;4;R$ 2.700.000
7487;Rua Angatuba, 519 ; Pacaembu; São Paulo ;687;4;6;4;R$ 10.000.000
7488;Rua Izonzo ; Sacomã; São Paulo ;100;3;3;2;R$ 606.000
7489;Vila Madalena, São Paulo ; SP;;400;4;5;4;"R$ 13.000
                      /Mês"
7490;Avenida Iraí ; Indianópolis; São Paulo ;300;3;2;4;R$ 2.200.000
7491;Jardim da Saúde, São Paulo ; SP;;127;3;1;5;R$ 1.190.000
7492;Jardim Marajoara, São Paulo ; SP;;400;4;6;6;R$ 2.650.000
7493;Bosque da Saúde, São Paulo ; SP;;297;3;1;6;R$ 1.600.000
7494;Rua Doutor João Vieira Neves, 125 ; Jardim Esmeralda; São Paulo ;140;3;2;3;R$ 550.000
7495;Rua Guariuba ; Vila Campanela; São Paulo ;134;3;1;1;R$ 420.000
7496;Rua Antônio Dario Menezes ; Vila Romano; São Paulo ;141;3;3;4;R$ 800.000
7497;Rua Geremia Lunardelli, 382 ; Jardim Peri Peri; São Paulo ;200;3;5;4;R$ 900.000
7498;Vila Bela, São Paulo ; SP;;340;3;1;8;R$ 1.280.000
7499;Rua General Pereira da Cunha, 505 ; Retiro Morumbi; São Paulo ;2200;6;6;12;R$ 19.000.000
7500;Rua Doutor Heitor Rodrigues de Souza ; Cidade Vargas; São Paulo ;354;4;5;3;"R$ 12.000
                      /Mês"
7501;Rua Aracitaba ; Morumbi; São Paulo ;463;3;6;4;R$ 1.950.000
7502;Rua Rocinha ; Bosque da Saúde; São Paulo ;160;5;4;3;R$ 990.000
7503;Praça Monsenhor Galvão de Sousa, 37738888 ; Jardim Guedala; São Paulo ;558;4;8;6;"R$ 22.000
                      /Mês"
7504;Rua Comandante Ismael Guilherme ; Jardim Luzitânia; São Paulo ;566;3;4;6;R$ 12.000.000
7505;Rua Conde D'Eu ; Santo Amaro; São Paulo ;150;3;3;2;R$ 2.100.000
7506;Rua Laplace, 962 ; Brooklin; São Paulo ;634;5;4;4;R$ 2.800.000
7507;Rua Honorato Faustino ; Alto de Pinheiros; São Paulo ;535;4;5;4;R$ 8.000.000
7508;Jardim América, São Paulo ; SP;;850;5;4;6;"R$ 50.000
                      /Mês"
7509;Parque dos Príncipes, São Paulo ; SP;;893;4;8;10;R$ 11.000.000
7510;Retiro Morumbi, São Paulo ; SP;;2000;5;11;30;"R$ 90.000
                      /Mês"
7511;Rua Atalanta ; Jardim São Paulo(Zona Norte); São Paulo ;200;3;2;3;R$ 700.000
7512;Vila Brasílio Machado, São Paulo ; SP;;110;3;2;2;R$ 650.000
7513;Rua Ribeiro do Vale ; Brooklin Paulista; São Paulo ;250;3;1;3;R$ 1.600.000
7514;Vila Simone, São Paulo ; SP;;285;4;3;3;R$ 636.000
7515;Rua Antônio Loureiro ; Vila Santa Catarina; São Paulo ;200;3;2;4;R$ 650.000
7516;Rua Araporé ; Jardim Guedala; São Paulo ;450;5;5;5;R$ 3.100.000
7517;Alto da Mooca, São Paulo ; SP;;800;3;2;4;R$ 1.600.000
7518;Rua Arcipreste Andrade ; Ipiranga; São Paulo ;120;2;1;1;R$ 800.000
7519;Rua Pedro Inácio de Araújo, 202 ; Vila São Silvestre; São Paulo ;98;2;1;2;R$ 590.000
7520;Rua General Gaudie Ley ; Interlagos; São Paulo ;350;4;5;8;R$ 1.600.000
7521;Rua Cornélio Procópio ; Saúde; São Paulo ;165;2;2;2;R$ 899.000
7522;Vila Nova Conceição, São Paulo ; SP;;177;3;2;3;R$ 2.875.000
7523;Rua Ossian Terceiro Teles ; Jardim Prudência; São Paulo ;250;3;4;3;R$ 1.100.000
7524;Rua Mário Enzio Pasqualucci ; Vila São Francisco (Zona Sul); São Paulo ;133;3;4;2;R$ 850.000
7525;Estrada Velha da Penha, , 441 ; Tatuapé; São Paulo ;125;2;2;2;R$ 530.000
7526;Rua Capitão José Inocêncio Taques Alvim ; Santo Amaro; São Paulo ;147;3;3;3;R$ 890.000
7527;Rua Comandante Ismael Guilherme ; Jardim Luzitânia; São Paulo ;600;3;6;4;R$ 12.000.000
7528;Avenida Dória ; Vila Alexandria; São Paulo ;130;2;2;1;R$ 650.000
7529;Rua Balata ; Jardim Guairaca; São Paulo ;276;3;3;6;R$ 950.000
7530;Rua Armando Brussolo ; Vila Romana; São Paulo ;254;3;3;2;R$ 1.900.000
7531;Rua Sargento Antenor Teixeira ; Jabaquara; São Paulo ;350;4;2;1;R$ 940.000
7532;Rua Maria Celina, 73 ; Vila Firmiano Pinto; São Paulo ;140;3;3;2;R$ 799.000
7533;Avenida Ipanema ; Veleiros; São Paulo ;75;2;2;2;R$ 700.000
7534;Vila Nivi, São Paulo ; SP;;72;2;1;2;R$ 380.000
7535;Rua Ubaíra ; Indianópolis; São Paulo ;200;3;4;4;R$ 1.990.000
7536;Vila Dom Pedro I, São Paulo ; SP;;173;2;2;4;R$ 1.250.000
7537;Rua Dom Luís Felipe de Orleans ; Vila Maria Baixa; São Paulo ;100;2;2;1;R$ 499.998
7538;Rua Jacques Félix ; Vila Nova Conceição; São Paulo ;200;3;3;4;R$ 7.920.000
7539;Saúde, São Paulo ; SP;;135;3;1;2;R$ 1.190.000
7540;Vila São Paulo, São Paulo ; SP;;190;3;1;2;R$ 1.400.000
7541;Jardim Vitória Régia, São Paulo ; SP;;568;4;5;4;R$ 5.500.000
7542;Itaim Bibi, São Paulo ; SP;;196;3;5;2;R$ 2.700.000
7543;Rua Milton Soares, 91 ; Jardim Sarah; São Paulo ;100;2;2;2;R$ 350.000
7544;Rua Visconde de Taunay ; Vila Cruzeiro; São Paulo ;125;2;2;2;R$ 950.000
7545;Rua dos Trilhos, , 1985 ; Mooca; São Paulo ;165;3;1;1;R$ 800.000
7546;Rua Groenlândia ; Jardim América; São Paulo ;420;4;5;5;R$ 8.500.000
7547;Rua Guaninas ; Jardim Aeroporto; São Paulo ;115;3;2;2;R$ 573.000
7548;Rua Amélia Augusta Rodrigues ; Cidade São Mateus; São Paulo ;120;3;2;2;R$ 261.252
7549;Vila Vera, São Paulo ; SP;;146;3;1;1;R$ 480.000
7550;Sumaré, São Paulo ; SP;;160;8;3;5;"R$ 8.500
                      /Mês"
7551;Avenida Manoel dos Reis Araújo ; Jardim Marajoara; São Paulo ;500;3;6;6;R$ 2.300.000
7552;Santo Amaro, São Paulo ; SP;;185;4;5;4;R$ 2.100.000
7553;Vila Monumento, São Paulo ; SP;;282;4;2;4;R$ 1.705.000
7554;Vila Brasílio Machado, São Paulo ; SP;;110;3;3;2;R$ 650.000
7555;Rua Roger Chaffee ; Interlagos; São Paulo ;345;4;6;4;R$ 2.500.000
7556;Rua Giácomo Carissimi, 178 ; Vila Adalgisa; São Paulo ;120;3;2;2;R$ 580.000
7557;Jardim Luzitânia, São Paulo ; SP;;260;3;4;3;R$ 5.250.000
7558;Rua Simão de Toledo Piza, , 246 ; Vila Libanesa; São Paulo ;157;2;1;2;R$ 640.000
7559;Rua Antônio Dario Menezes ; Vila Romano; São Paulo ;141;3;1;4;R$ 800.000
7560;Jardim da Glória, São Paulo ; SP;;200;3;4;3;R$ 1.000.000
7561;Jardim da Glória, São Paulo ; SP;;233;3;2;5;R$ 2.000.000
7562;Rua Cayowaá ; Perdizes; São Paulo ;280;3;1;2;R$ 1.200.000
7563;Bosque da Saúde, São Paulo ; SP;;347;4;4;6;R$ 2.100.000
7564;Rua do Minho, 50 ; Jardim Luzitânia; São Paulo ;300;4;7;4;"R$ 13.000
                      /Mês"
7565;Vila Madalena, São Paulo ; SP;;380;7;5;6;R$ 2.900.000
7566;Bosque da Saúde, São Paulo ; SP;;288;3;1;6;R$ 1.200.000
7567;Alto da Lapa, São Paulo ; SP;;360;3;4;6;R$ 2.400.000
7568;Rua Orozimbo Maia, 171 ; Alto da Mooca; São Paulo ;220;6;7;6;R$ 2.000.000
7569;Vila Clementino, São Paulo ; SP;;70;1;1;2;R$ 953.000
7570;Vila Moinho Velho, São Paulo ; SP;;150;3;1;2;R$ 700.000
7571;Travessa Nicolas Jancu, 0 ; Jardim Virginia Bianca; São Paulo ;367;3;4;4;R$ 1.684.000
7572;Rua Ana Vieira de Carvalho ; Jardim Panorama; São Paulo ;350;3;4;5;R$ 3.900.000
7573;Rua Nhu;Guaçu ;;75;2;2;2;R$ 750.000
7574;Rua João Cordeiro, 00 ; Vila Carrão; São Paulo ;480;4;10;4;R$ 1.580.000
7575;Santana, São Paulo ; SP;;250;4;4;5;R$ 1.800.000
7576;Brooklin Paulista, São Paulo ; SP;;330;5;6;5;R$ 2.280.000
7577;Retiro Morumbi, São Paulo ; SP;;986;4;6;3;R$ 4.000.000
7578;Avenida Santo Albano ; Vila Vera; São Paulo ;265;3;5;8;R$ 689.000
7579;Rua Melo Morais Filho ; Jardim Guedala; São Paulo ;545;4;6;10;R$ 8.500.000
7580;Vila Ida, São Paulo ; SP;;235;3;3;7;R$ 2.300.000
7581;Avenida Professor Rubens Gomes de Souza ; Jardim Cordeiro; São Paulo ;500;4;5;6;R$ 9.000.000
7582;Cidade Monções, São Paulo ; SP;;102;2;4;2;R$ 1.200.000
7583;Cidade Jardim, São Paulo ; SP;;410;3;5;4;R$ 4.000.000
7584;Rua Comendador Bichara Moherdauí ; Jardim Leonor; São Paulo ;798;5;7;8;R$ 4.950.000
7585;Rua Esmeralda ; Aclimação; São Paulo ;120;3;4;2;R$ 1.000.000
7586;Chácara Monte Alegre, São Paulo ; SP;;352;4;4;3;R$ 1.800.000
7587;Rua Professor Araújo Maciel ; Vila Fachini; São Paulo ;158;4;2;2;R$ 550.000
7588;Jardim Europa, São Paulo ; SP;;300;4;6;4;R$ 4.300.000
7589;Rua Caracas ; Vila Nova Conceição; São Paulo ;156;3;3;2;R$ 2.184.000
7590;Bosque da Saúde, São Paulo ; SP;;650;4;1;12;R$ 2.600.000
7591;Rua México, 50 ; Jardim América; São Paulo ;581;3;3;20;R$ 30.000.000
7592;Morumbi, São Paulo ; SP;;868;4;4;9;R$ 6.000.000
7593;Vila Sônia, São Paulo ; SP;;288;4;3;4;R$ 1.200.000
7594;Rua Bartolomeu Rampini, 111 ; Parque Maria Fernandes; São Paulo ;200;4;1;1;R$ 300.000
7595;Avenida Vicente Paiva ; Vila Progredior; São Paulo ;715;4;6;8;R$ 4.500.000
7596;Jardim Guedala, São Paulo ; SP;;420;4;4;4;R$ 3.180.000
7597;Fazenda Morumbi, São Paulo ; SP;;296;4;4;4;R$ 6.200.000
7598;Rua Carmo do Cajuru ; Jardim Guedala; São Paulo ;650;4;6;4;R$ 3.500.000
7599;Rua Mário, 387 ; Vila Romana; São Paulo ;169;3;3;2;R$ 1.100.000
7600;Rua Conde D'Eu ; Santo Amaro; São Paulo ;800;5;1;6;R$ 6.000.000
7601;Vila Lúcia, São Paulo ; SP;;232;3;3;2;R$ 1.280.000
7602;Rua Reverendo Israel Vieira Ferreira ; Vila Medeiros; São Paulo ;260;4;4;3;R$ 760.000
7603;Vila Gumercindo, São Paulo ; SP;;211;3;1;2;R$ 1.000.000
7604;Rua República do Iraque ; Campo Belo; São Paulo ;350;4;7;4;R$ 3.490.000
7605;Rua Líbero Ripole ; Jardim Umuarama; São Paulo ;214;3;5;2;R$ 1.150.000
7606;Rua Melo Morais Filho ; Jardim Guedala; São Paulo ;545;4;5;10;R$ 8.500.000
7607;Vila Moraes, São Paulo ; SP;;200;3;1;4;R$ 850.000
7608;Rua David Ben Gurion, 955 ; Jardim Monte Kemel; São Paulo ;179;4;5;4;R$ 900.000
7609;Jardim Paulista, São Paulo ; SP;;700;5;5;4;R$ 11.500.000
7610;Rua Arataca ; Chácara Monte Alegre; São Paulo ;500;3;5;4;R$ 3.500.000
7611;Rua Henri Poincare ; Jardim Coimbra; São Paulo ;97;2;2;1;R$ 467.000
7612;Rua Alemanha, 400 ; Jardim Europa; São Paulo ;570;5;8;6;"R$ 45.000
                      /Mês"
7613;Rua Engenheiro Sá Rocha ; Vila Ida; São Paulo ;331;4;4;5;"R$ 19.900
                      /Mês"
7614;Jardim Guedala, São Paulo ; SP;;443;4;7;7;"R$ 18.000
                      /Mês"
7615;Rua Nova Pátria ; Bosque da Saúde; São Paulo ;230;3;4;4;R$ 1.280.000
7616;Rua Eva Bloch, 11 ; Bosque da Saúde; São Paulo ;150;4;3;4;R$ 1.802.000
7617;Jardim Paulistano, São Paulo ; SP;;496;4;3;5;R$ 3.800.000
7618;Alameda dos Indígenas, 364 ; Planalto Paulista; São Paulo ;314;3;3;4;R$ 1.450.000
7619;Rua Saramenha ; Sumaré; São Paulo ;330;3;5;5;R$ 1.850.000
7620;Santo Amaro, São Paulo ; SP;;200;2;2;4;R$ 1.650.000
7621;Rua Bernardo Sanches, 80 ; Real Parque; São Paulo ;309;2;3;2;R$ 2.800.000
7622;Rua Rubem de Souza, 36 ; Vila Inglesa; São Paulo ;390;3;2;3;R$ 1.400.000
