;Rua;Bairro;Cidade;area_m2;quartos;banheiros;vagas;price
4829;Jardim Leonor, São Paulo ; SP;;554;4;2;3;R$ 2.500.000
4830;Jardim das Bandeiras, São Paulo ; SP;;709;4;6;6;R$ 12.500.000
4831;Alameda dos Uapês ; Planalto Paulista; São Paulo ;300;3;2;2;R$ 2.100.000
4832;Rua Basílio da Cunha ; Vila Deodoro; São Paulo ;120;2;2;1;R$ 595.000
4833;Cidade Jardim, São Paulo ; SP;;380;3;5;4;R$ 4.000.000
4834;Cidade Jardim, São Paulo ; SP;;704;4;7;4;R$ 6.000.000
4835;Pacaembu, São Paulo ; SP;;330;4;4;3;R$ 3.500.000
4836;Rua Alexandre Buairide ; Vila Mariana; São Paulo ;270;4;5;3;R$ 1.600.000
4837;Rua Nova Aurora ; Vila Guilhermina; São Paulo ;439;5;7;5;R$ 1.500.000
4838;Lar São Paulo, São Paulo ; SP;;340;4;4;6;R$ 1.395.000
4839;Jardim Guedala, São Paulo ; SP;;659;5;2;6;R$ 2.800.000
4840;Vila Ida, São Paulo ; SP;;490;5;6;10;R$ 2.970.000
4841;Brooklin Paulista, São Paulo ; SP;;600;3;5;4;R$ 2.000.000
4842;Vila Ré, São Paulo ; SP;;60;2;3;1;R$ 298.000
4843;Parque Jabaquara, São Paulo ; SP;;300;4;6;4;R$ 1.950.000
4844;Rua Dráusio ; Butantã; São Paulo ;277;4;5;3;R$ 1.650.000
4845;Rua Ribeiro Lisboa ; Fazenda Morumbi; São Paulo ;404;3;4;6;R$ 3.800.000
4846;Rua Valença ; Sumaré; São Paulo ;280;4;7;3;R$ 2.600.000
4847;Rua Bamboré ; Ipiranga; São Paulo ;400;3;4;6;"R$ 7.000
                      /Mês"
4848;Rua João de Laet ; Vila Aurora (Zona Norte); São Paulo ;1080;5;5;10;R$ 2.600.000
4849;Parque Novo Mundo, São Paulo ; SP;;455;6;6;12;R$ 2.800.000
4850;Paineiras do Morumbi, São Paulo ; SP;;1005;4;8;8;R$ 6.500.000
4851;Jardim Guedala, São Paulo ; SP;;500;4;4;4;R$ 3.500.000
4852;Jardim Londrina, São Paulo ; SP;;268;4;5;4;R$ 1.200.000
4853;Rua Santa Bibiana ; Vila Sônia; São Paulo ;250;3;4;6;R$ 1.100.000
4854;Rua José Guilherme Guimarães Pedroso, 0 ; Vila Campo Grande; São Paulo ;220;3;4;8;R$ 590.000
4855;Rua Maria Leonete da Silva Nóbrega ; Vila Ida; São Paulo ;234;3;4;4;R$ 2.498.000
4856;Rua Aurélia ; Vila Romana; São Paulo ;90;2;1;1;R$ 680.000
4857;Vila Mafra, São Paulo ; SP;;231;3;4;3;R$ 1.490.000
4858;Jardim das Acácias, São Paulo ; SP;;120;2;2;3;R$ 1.350.000
4859;Rua José Maria Gonzales ; Jardim Cidália; São Paulo ;195;3;6;5;R$ 1.200.000
4860;Rua Heitor Peixoto ; Cambuci; São Paulo ;220;3;4;1;R$ 1.000.000
4861;Interlagos, São Paulo ; SP;;287;4;4;4;R$ 1.100.000
4862;Rua Dom Henrique ; Jardim Luzitânia; São Paulo ;394;4;6;3;"R$ 14.000
                      /Mês"
4863;Jardim Taboão, São Paulo ; SP;;266;4;5;3;R$ 945.000
4864;Rua Primavera ; Jardim Paulista; São Paulo ;380;3;3;2;R$ 3.200.000
4865;Rua Pereira Caldas ; Jardim da Glória; São Paulo ;218;3;1;2;R$ 850.000
4866;Rua Sampaio Vidal, 297 ; Jardim Paulistano; São Paulo ;244;2;4;2;R$ 5.800.000
4867;Rua Corveta Camacua, 200 ; Vila Inah; São Paulo ;360;4;5;6;R$ 1.200.000
4868;Rua Padre Agostinho Mendicute ; Sumaré; São Paulo ;130;2;2;1;R$ 980.000
4869;Jardim Paulista, São Paulo ; SP;;298;3;5;4;R$ 3.700.000
4870;Rua Pau;Brasil ;;500;4;4;6;R$ 3.900.000
4871;Cidade Jardim, São Paulo ; SP;;802;5;8;5;R$ 7.500.000
4872;Rua Alabastro ; Aclimação; São Paulo ;160;3;2;3;R$ 1.000.000
4873;Vila Cardoso Franco, São Paulo ; SP;;80;3;2;1;R$ 180.000
4874;Rua Heitor de Morais ; Pacaembu; São Paulo ;500;4;4;10;R$ 2.100.000
4875;Jardim Panorama, São Paulo ; SP;;350;4;4;3;R$ 2.450.000
4876;Rua Parnaíba Paoliello ; Jardim Oriental; São Paulo ;175;5;3;2;R$ 600.000
4877;Rua Marcelino Champagnat ; Jardim da Glória; São Paulo ;237;4;4;3;R$ 1.650.000
4878;Rua Sebastião Falconi, 168 ; Jardim Taboao; São Paulo ;162;3;3;2;R$ 550.000
4879;Rua Manuel Pereira Guimarães ; Granja Julieta; São Paulo ;203;3;4;2;R$ 1.600.000
4880;Jardim Guedala, São Paulo ; SP;;706;5;9;10;R$ 5.800.000
4881;Vila Nova Conceição, São Paulo ; SP;;112;3;3;2;"R$ 7.500
                      /Mês"
4882;Rua Guararapes ; Brooklin Paulista; São Paulo ;180;3;3;3;R$ 1.500.001
4883;Rua Geórgia ; Brooklin Paulista; São Paulo ;160;3;4;4;R$ 1.700.000
4884;Rua Embaixador Raul García ; Vila Mariana; São Paulo ;89;3;3;2;R$ 1.200.000
4885;Rua Barajuba, 111 ; Alto de Pinheiros; São Paulo ;420;4;4;4;R$ 5.500.000
4886;Jardim Campo Grande, São Paulo ; SP;;175;4;3;3;R$ 1.499.000
4887;Santo Amaro, São Paulo ; SP;;168;3;4;4;R$ 1.450.000
4888;Avenida Comendador Adibo Ares ; Morumbi; São Paulo ;900;3;6;8;R$ 7.700.000
4889;Vila Bertioga, São Paulo ; SP;;144;2;2;3;R$ 580.000
4890;Rua Catanduva ; Pacaembu; São Paulo ;230;3;4;5;R$ 2.900.000
4891;Rua Gassipós ; Vila Mariana; São Paulo ;165;3;3;2;R$ 2.140.000
4892;Rua Simão Dias da Fonseca ; Cambuci; São Paulo ;180;2;3;2;R$ 930.000
4893;Rua Doutor Octávio de Oliveira Santos ; Brooklin; São Paulo ;190;4;4;3;R$ 1.300.000
4894;Rua Senador Felício dos Santos ; Liberdade; São Paulo ;600;3;1;4;R$ 2.000.000
4895;Jardim Textil, São Paulo ; SP;;350;4;1;3;R$ 1.600.000
4896;Rua Porto Torres ; Interlagos; São Paulo ;600;4;7;10;R$ 3.700.000
4897;Jardim América, São Paulo ; SP;;420;3;4;6;R$ 8.900.000
4898;Rua João Geraldo, 136 ; Vila Matilde; São Paulo ;115;3;2;2;R$ 480.012
4899;Rua Suécia ; Jardim Europa; São Paulo ;872;4;7;7;R$ 18.000.000
4900;Avenida Piassanguaba ; Planalto Paulista; São Paulo ;275;4;4;6;"R$ 5.000
                      /Mês"
4901;Rua Bela Vista ; Santo Amaro; São Paulo ;200;2;1;4;R$ 1.650.000
4902;Rua Tenente Azevedo ; Aclimação; São Paulo ;128;3;3;2;R$ 950.000
4903;Rua Roque Petrella ; Vila Cordeiro; São Paulo ;160;3;3;1;R$ 850.000
4904;Jardim Everest, São Paulo ; SP;;500;3;5;6;R$ 6.000.000
4905;Rua Cardeal Cagliori ; Alto de Pinheiros; São Paulo ;400;4;5;4;R$ 3.500.000
4906;Jardim Guedala, São Paulo ; SP;;760;5;8;9;R$ 7.500.000
4907;Rua Almirante Soares Dutra ; Morumbi; São Paulo ;450;5;7;4;R$ 2.150.000
4908;Rua Luís Araújo Faria, 317 ; Jardim Monte Kemel; São Paulo ;150;3;1;3;R$ 640.000
4909;Rua Gibraltar ; Santo Amaro; São Paulo ;120;2;1;1;R$ 579.000
4910;Rua Itaquera ; Pacaembu; São Paulo ;400;6;7;4;R$ 2.800.000
4911;Rua Choneco ; Vila Ré; São Paulo ;210;3;1;4;R$ 840.000
4912;Rua São Luís ; Guaianases; São Paulo ;90;3;3;2;R$ 750.000
4913;Jardim Morumbi, São Paulo ; SP;;350;4;3;4;R$ 2.450.000
4914;Rua Honduras ; Jardim Paulista; São Paulo ;917;5;8;10;R$ 17.500.000
4915;Rua Puréus, 37738888 ; Jardim Guedala; São Paulo ;650;4;6;6;R$ 6.300.000
4916;Rua Araioses ; Sumarezinho; São Paulo ;179;3;4;4;R$ 1.590.000
4917;Rua Ferdinando Laboriau ; Pacaembu; São Paulo ;420;4;4;6;R$ 3.480.000
4918;Rua Doutor José Maria do Vale ; Vila Mariana; São Paulo ;260;3;4;3;R$ 1.900.000
4919;Rua Antônio Gomes Correa ; Jardim Catanduva; São Paulo ;206;3;3;2;R$ 510.000
4920;Rua Fonseca da Costa ; Bosque da Saúde; São Paulo ;271;4;4;8;R$ 2.500.000
4921;Cidade Jardim, São Paulo ; SP;;650;4;6;6;R$ 4.800.000
4922;Rua Ernesto Fogo ; Jardim Colorado; São Paulo ;160;3;2;2;R$ 480.000
4923;Rua Izonzo, 100 ; Sacomã; São Paulo ;200;3;2;2;R$ 650.000
4924;Alameda Uapixana ; Indianópolis; São Paulo ;138;4;3;3;R$ 1.250.000
4925;Vila Mazzei, São Paulo ; SP;;140;3;2;2;R$ 700.000
4926;Rua Bandim ; Boaçava; São Paulo ;520;4;6;7;R$ 4.200.000
4927;Alto da Lapa, São Paulo ; SP;;300;4;4;5;R$ 2.650.000
4928;Rua Itatiaia, 0 ; Vila Guarani (Z Sul); São Paulo ;265;3;4;2;"R$ 4.000
                      /Mês"
4929;Rua Doutor Nelson Cayres de Britto ; Vila Tiradentes; São Paulo ;210;3;2;2;R$ 700.000
4930;Chácara Santo Antônio (Zona Sul), São Paulo ; SP;;130;3;2;1;R$ 1.200.000
4931;Rua José de Freitas Guimarães ; Pacaembu; São Paulo ;400;3;4;4;R$ 2.150.000
4932;Boaçava, São Paulo ; SP;;650;4;5;6;R$ 9.000.000
4933;Rua dos Miranhas ; Vila Madalena; São Paulo ;250;5;4;3;R$ 2.650.000
4934;Jardim Leonor, São Paulo ; SP;;633;4;5;8;"R$ 10.000
                      /Mês"
4935;Avenida Lins de Vasconcelos ; Cambuci; São Paulo ;198;3;2;6;R$ 950.000
4936;Vila Nova Conceição, São Paulo ; SP;;250;3;3;3;R$ 3.500.000
4937;Rua Baré ; Vila Romana; São Paulo ;450;3;3;3;R$ 3.800.000
4938;Rua Aldo Samarão Guimarães Filho, 12 ; Jardim Esmeralda; São Paulo ;310;4;3;7;R$ 740.000
4939;Rua das Tuias ; Cidade Jardim; São Paulo ;746;5;5;3;R$ 4.600.000
4940;Alto de Pinheiros, São Paulo ; SP;;480;4;4;4;R$ 3.250.000
4941;Rua Frederico Von Martius ; Ipiranga; São Paulo ;299;3;5;2;R$ 1.400.000
4942;Jardim Leonor, São Paulo ; SP;;318;3;5;4;R$ 1.900.000
4943;Rua Joazeiro, 66 ; Sumaré; São Paulo ;550;3;6;6;R$ 3.600.000
4944;Rua Maestro Elias Lobo ; Jardim Paulista; São Paulo ;224;3;3;2;R$ 3.000.000
4945;Rua Francisco Cioffi ; Vila Bertioga; São Paulo ;329;4;6;4;R$ 1.900.000
4946;Rua Luís César Pannain ; Alto da Lapa; São Paulo ;340;3;6;4;R$ 2.700.000
4947;Rua Guaones, 70 ; Jardim Guedala; São Paulo ;600;4;7;6;R$ 5.000.000
4948;Avenida Valentim Gentil ; Butantã; São Paulo ;500;5;5;5;"R$ 22.000
                      /Mês"
4949;Retiro Morumbi, São Paulo ; SP;;450;4;5;6;"R$ 20.000
                      /Mês"
4950;Rua dos Viajantes ; Vila Monumento; São Paulo ;165;4;5;2;R$ 980.000
4951;Caxingui, São Paulo ; SP;;580;5;7;8;R$ 3.000.000
4952;Rua Espírito Santo ; Aclimação; São Paulo ;200;3;4;6;R$ 1.200.000
4953;Rua Doutor Luís Augusto de Queirós Aranha ; Vila Madalena; São Paulo ;147;3;3;2;R$ 1.200.000
4954;Rua Caçador de Esmeraldas ; Vila São José; São Paulo ;165;2;2;2;R$ 840.000
4955;Rua Jaime Cortezão ; Granja Julieta; São Paulo ;636;6;5;4;R$ 4.412.000
4956;Avenida Engenheiro Saraiva de Oliveira ; Jardim Taboão; São Paulo ;200;4;4;3;"R$ 4.500
                      /Mês"
4957;Jardim Everest, São Paulo ; SP;;679;4;5;4;R$ 3.500.000
4958;Rua Dom Luís Felipe de Orleans ; Vila Maria Baixa; São Paulo ;100;2;2;1;R$ 499.998
4959;Rua Teodoro Ramos ; Pacaembu; São Paulo ;280;3;3;4;R$ 2.850.000
4960;Rua Horácio Bandieri ; Jardim Leonor; São Paulo ;1050;5;10;6;R$ 7.500.000
4961;Alameda Campinas ; Jardim Paulista; São Paulo ;173;2;2;2;R$ 3.540.000
4962;Brooklin Paulista, São Paulo ; SP;;240;3;4;2;R$ 2.250.000
4963;Rua Princesa Isabel ; Campo Belo; São Paulo ;80;2;2;2;R$ 850.000
4964;Rua Joel Jorge de Melo ; Vila Mariana; São Paulo ;90;2;2;1;R$ 799.000
4965;Vila Madalena, São Paulo ; SP;;383;4;4;4;R$ 3.500.000
4966;Praça Cruzador Bahia ; Vila Inah; São Paulo ;300;4;5;4;R$ 1.950.000
4967;Sumaré, São Paulo ; SP;;150;2;3;2;"R$ 12.000
                      /Mês"
4968;Rua Campo Verde ; Jardim Europa; São Paulo ;329;4;6;4;R$ 6.500.000
4969;Travessa Doutor Ezequiel Antunes de Oliveira ; Vila Nova Conceição; São Paulo ;170;3;5;3;R$ 2.850.000
4970;Vila Andrade, São Paulo ; SP;;188;3;5;5;R$ 950.000
4971;Jardim da Saúde, São Paulo ; SP;;140;3;2;3;R$ 800.000
4972;Rua João de Sousa Dias ; Campo Belo; São Paulo ;100;3;3;1;R$ 1.200.000
4973;Rua Peixe Vivo ; Jardim Santa Helena; São Paulo ;339;3;2;3;R$ 720.000
4974;Rua Banibás ; Alto de Pinheiros; São Paulo ;496;5;6;7;R$ 6.800.000
4975;Rua Majubim ; Alto da Lapa; São Paulo ;118;3;4;2;R$ 1.200.000
4976;Avenida Morumbi, 444 ; Morumbi; São Paulo ;800;7;7;4;R$ 3.500.000
4977;Rua Pedro Teixeira ; Vila Olímpia; São Paulo ;130;3;2;1;R$ 1.100.000
4978;Rua Heitor Peixoto ; Cambuci; São Paulo ;220;3;4;1;R$ 1.000.000
4979;Vila Nova Conceição, São Paulo ; SP;;150;2;3;1;R$ 2.500.000
4980;Rua Honduras ; Jardim Paulista; São Paulo ;1000;5;6;7;R$ 8.000.000
4981;Rua Comendador Elias Zarzur ; Santo Amaro; São Paulo ;500;4;10;50;R$ 3.700.000
4982;Rua Winifred ; Vila Carrão; São Paulo ;147;3;3;2;R$ 1.300.000
4983;Rua Espírito Santo ; Aclimação; São Paulo ;250;6;4;2;R$ 1.940.000
4984;Rua Januário Miraglia ; Vila Nova Conceição; São Paulo ;240;1;3;3;R$ 6.000.000
4985;Rua Corneteiro Jesus ; Água Fria; São Paulo ;170;3;5;2;R$ 1.290.000
4986;Rua Doutor Jacques Tupinambá ; Vila Baby; São Paulo ;103;3;2;2;R$ 390.000
4987;Pinheiros, São Paulo ; SP;;200;3;5;3;R$ 2.500.000
4988;Santo Amaro, São Paulo ; SP;;440;4;4;6;R$ 1.980.000
4989;Pacaembu, São Paulo ; SP;;359;4;5;4;R$ 3.400.000
4990;Rua Argentina ; Jardim América; São Paulo ;1100;5;6;8;R$ 30.000.000
4991;Rua São Fortunato ; Interlagos; São Paulo ;320;3;3;2;R$ 1.290.000
4992;Jardim Colombo, São Paulo ; SP;;169;3;4;4;R$ 970.000
4993;Rua Maria Curupaiti ; Vila Ester (Zona Norte); São Paulo ;109;3;2;1;R$ 800.000
4994;Rua Pongada, 75 ; Jardim Panorama; São Paulo ;410;4;6;4;"R$ 15.000
                      /Mês"
4995;Jardim Guedala, São Paulo ; SP;;800;5;7;6;R$ 4.000.000
4996;Rua Próspero Cesarino Paoliello ; Conjunto Residencial Butantã; São Paulo ;130;2;2;2;R$ 640.000
4997;Rua dos Jequitibás ; Jardim Oriental; São Paulo ;760;4;1;4;R$ 3.500.000
4998;Rua Doutor Olívio Uzeda Moreira ; Alto da Lapa; São Paulo ;120;2;2;1;R$ 1.900.000
4999;Vila Mariana, São Paulo ; SP;;180;3;2;2;R$ 870.000
5000;Rua José Ricardo Athayde Marcondes ; Vila Sônia; São Paulo ;273;3;5;3;R$ 2.500.000
5001;Jardim Guedala, São Paulo ; SP;;496;4;1;4;R$ 3.000.000
5002;Rua Santos Dumont, , 438 ; Jardim Petrópolis; São Paulo ;567;5;9;4;R$ 3.490.000
5003;Vila Cordeiro, São Paulo ; SP;;184;3;4;4;R$ 1.700.000
5004;Rua Jaguanambi ; Cidade Jardim; São Paulo ;456;4;8;3;R$ 2.590.000
5005;Rua Albina Barbosa ; Aclimação; São Paulo ;240;4;4;3;R$ 1.999.900
5006;Rua Silveira Sampaio, 0 ; Fazenda Morumbi; São Paulo ;1000;5;7;4;R$ 6.500.000
5007;Rua Duílio Santo Suosso ; Jardim Tenani; São Paulo ;180;4;5;6;R$ 1.360.000
5008;Rua Padre Manuel Luís de Vergueiro ; Vila Antonieta; São Paulo ;220;3;2;4;R$ 500.000
5009;Rua Laiana ; Alto de Pinheiros; São Paulo ;360;3;7;6;R$ 5.500.000
5010;Rua Joazeiro ; Sumaré; São Paulo ;550;3;7;6;R$ 3.600.000
5011;Rua Godói Preto ; Brás; São Paulo ;180;5;3;5;R$ 1.600.000
5012;Rua Xerentes ; Pompeia; São Paulo ;160;3;1;1;R$ 1.590.000
5013;Saúde, São Paulo ; SP;;180;4;3;5;"R$ 3.500
                      /Mês"
5014;Rua João Batista Leme da Silva ; Vila Madalena; São Paulo ;174;4;4;2;R$ 1.219.000
5015;Jardim América, São Paulo ; SP;;890;3;4;8;"R$ 65.000
                      /Mês"
5016;Rua Santo Eufredo ; Jardim Guedala; São Paulo ;763;4;5;5;R$ 5.400.000
5017;Vila Nair, São Paulo ; SP;;120;2;2;2;R$ 650.000
5018;Vila Cordeiro, São Paulo ; SP;;169;3;4;2;R$ 1.250.000
5019;Rua Tomé Portes ; Brooklin Paulista; São Paulo ;650;4;5;6;"R$ 10.000
                      /Mês"
5020;Vila Progredior, São Paulo ; SP;;260;3;3;3;R$ 1.500.000
5021;Rua Marie Nader Calfat ; Jardim Ampliação; São Paulo ;20;3;2;2;R$ 800.000
5022;Rua Blumenau, 105 ; Vila Leopoldina; São Paulo ;125;3;4;2;R$ 695.000
5023;Jardim Monte Kemel, São Paulo ; SP;;189;4;5;3;R$ 799.000
5024;Avenida Parada Pinto ; Vila Nova Cachoeirinha; São Paulo ;280;3;3;6;"R$ 4.000
                      /Mês"
5025;Quinta da Paineira, São Paulo ; SP;;260;3;3;3;R$ 720.000
5026;Rua Caropá, 490 ; Vila Madalena; São Paulo ;217;4;5;4;R$ 1.800.000
5027;Rua Plínio Salgado, 167 ; Jardim Peri Peri; São Paulo ;151;2;2;3;R$ 1.500.000
5028;Rua Frederico Von Martius, , 73 ; Vila Monumento; São Paulo ;300;3;5;2;R$ 1.399.900
5029;Jardim América, São Paulo ; SP;;600;3;3;4;"R$ 28.000
                      /Mês"
5030;Rua Amílcar Barbuy ; Parque São Domingos; São Paulo ;180;4;5;3;R$ 1.200.000
5031;Rua Colatino Marques ; Jardim Paulista; São Paulo ;320;3;5;2;"R$ 17.000
                      /Mês"
5032;Rua Almirante Pereira Guimarães ; Pacaembu; São Paulo ;700;5;5;16;R$ 5.897.000
5033;Rua Demóstenes ; Campo Belo; São Paulo ;119;2;2;2;R$ 850.000
5034;Rua Pero Correia, 314 ; Vila Mariana; São Paulo ;296;4;6;3;R$ 1.300.000
5035;Rua Ita ; Vila Santos; São Paulo ;135;3;2;2;R$ 499.000
5036;Rua Marcelino Champagnat ; Jardim da Glória; São Paulo ;250;4;4;2;R$ 1.600.000
5037;Rua General Manuel Vargas ; Cidade Vargas; São Paulo ;96;3;1;2;R$ 658.000
5038;Perdizes, São Paulo ; SP;;200;3;3;2;R$ 997.000
5039;Chácara Monte Alegre, São Paulo ; SP;;454;3;5;3;R$ 3.300.000
5040;Praça Pinheiro da Cunha ; Ipiranga; São Paulo ;174;3;3;4;R$ 900.000
5041;Rua Caixanas, 37738888 ; Jardim Guedala; São Paulo ;551;4;8;6;R$ 5.000.000
5042;Rua Cambará ; Vila Bertioga; São Paulo ;170;3;4;4;R$ 1.050.000
5043;Jardim Leonor, São Paulo ; SP;;550;4;5;4;R$ 3.500.000
5044;Rua Agostinho Gomes ; Ipiranga; São Paulo ;150;2;3;2;R$ 1.020.000
5045;Rua Conselheiro Torres Homem, 285 ; Jardim Paulista; São Paulo ;250;4;5;4;R$ 4.900.000
5046;Rua Groenlândia ; Jardim América; São Paulo ;815;4;8;4;R$ 25.000.000
5047;Jardim Gonzaga, São Paulo ; SP;;378;10;8;8;R$ 950.000
5048;Rua Palmares ; Brooklin Paulista; São Paulo ;315;4;5;5;R$ 1.700.000
5049;Vila Madalena, São Paulo ; SP;;223;4;3;3;R$ 1.900.010
5050;Rua Nestor Moreira ; Jardim da Glória; São Paulo ;234;3;1;2;R$ 1.500.000
5051;Liberdade, São Paulo ; SP;;90;3;2;1;R$ 600.000
5052;Rua Amsterdam ; Vila Campestre; São Paulo ;124;3;2;2;R$ 600.000
5053;Jardim Campo Grande, São Paulo ; SP;;190;3;3;4;R$ 1.500.000
5054;Rua Colombo Florence ; Parque Fongaro; São Paulo ;370;3;3;6;R$ 930.000
5055;Rua Geórgia, 2032 ; Brooklin Paulista; São Paulo ;320;4;6;5;"R$ 12.000
                      /Mês"
5056;Rua Dom Sebastião do Rego ; Vila Gumercindo; São Paulo ;174;3;2;2;R$ 750.000
5057;Rua Nova York ; Brooklin Paulista; São Paulo ;350;3;1;3;R$ 2.500.000
5058;Avenida Amarilis ; Cidade Jardim; São Paulo ;840;4;7;8;R$ 5.900.000
5059;Vila Carrão, São Paulo ; SP;;350;3;3;8;R$ 1.200.000
5060;Rua Joaquim de Almeida ; Mirandópolis; São Paulo ;90;3;1;2;R$ 1.100.000
5061;Rua Perucaba, 153 ; Tatuapé; São Paulo ;290;2;3;5;R$ 1.700.000
5062;Pacaembu, São Paulo ; SP;;300;4;5;6;R$ 2.450.000
5063;Vila Ida, São Paulo ; SP;;490;5;5;10;R$ 2.400.000
5064;Rua Messina ; Jardim Leonor Mendes de Barros; São Paulo ;260;3;5;6;R$ 1.600.000
5065;Jardim América, São Paulo ; SP;;890;3;4;8;"R$ 65.000
                      /Mês"
5066;Rua Santo Eufredo ; Jardim Guedala; São Paulo ;763;4;5;5;R$ 5.400.000
5067;Vila Nair, São Paulo ; SP;;120;2;2;2;R$ 650.000
5068;Vila Cordeiro, São Paulo ; SP;;169;3;4;2;R$ 1.250.000
5069;Rua Tomé Portes ; Brooklin Paulista; São Paulo ;650;4;5;6;"R$ 10.000
                      /Mês"
5070;Vila Progredior, São Paulo ; SP;;260;3;3;3;R$ 1.500.000
5071;Rua Marie Nader Calfat ; Jardim Ampliação; São Paulo ;20;3;2;2;R$ 800.000
5072;Rua Blumenau, 105 ; Vila Leopoldina; São Paulo ;125;3;4;2;R$ 695.000
5073;Jardim Monte Kemel, São Paulo ; SP;;189;4;5;3;R$ 799.000
5074;Avenida Parada Pinto ; Vila Nova Cachoeirinha; São Paulo ;280;3;3;6;"R$ 4.000
                      /Mês"
5075;Quinta da Paineira, São Paulo ; SP;;260;3;3;3;R$ 720.000
5076;Rua Caropá, 490 ; Vila Madalena; São Paulo ;217;4;5;4;R$ 1.800.000
5077;Rua Tomé Portes ; Brooklin Paulista; São Paulo ;266;4;5;2;R$ 1.500.000
5078;Avenida Padre Pereira de Andrade ; Boaçava; São Paulo ;312;3;4;5;R$ 3.150.000
5079;Rua Plínio Salgado, 167 ; Jardim Peri Peri; São Paulo ;151;2;2;3;R$ 1.500.000
5080;Rua Frederico Von Martius, , 73 ; Vila Monumento; São Paulo ;300;3;5;2;R$ 1.399.900
5081;Jardim América, São Paulo ; SP;;600;3;3;4;"R$ 28.000
                      /Mês"
5082;Rua Amílcar Barbuy ; Parque São Domingos; São Paulo ;180;4;5;3;R$ 1.200.000
5083;Rua Colatino Marques ; Jardim Paulista; São Paulo ;320;3;5;2;"R$ 17.000
                      /Mês"
5084;Rua Almirante Pereira Guimarães ; Pacaembu; São Paulo ;700;5;5;16;R$ 5.897.000
5085;Rua Demóstenes ; Campo Belo; São Paulo ;119;2;2;2;R$ 850.000
5086;Rua Pero Correia, 314 ; Vila Mariana; São Paulo ;296;4;6;3;R$ 1.300.000
5087;Rua Ita ; Vila Santos; São Paulo ;135;3;2;2;R$ 499.000
5088;Rua Ubaíra ; Indianópolis; São Paulo ;200;3;4;4;R$ 1.990.000
5089;Rua Marcelino Champagnat ; Jardim da Glória; São Paulo ;250;4;4;2;R$ 1.600.000
5090;Rua General Manuel Vargas ; Cidade Vargas; São Paulo ;96;3;1;2;R$ 658.000
5091;Perdizes, São Paulo ; SP;;200;3;3;2;R$ 997.000
5092;Chácara Monte Alegre, São Paulo ; SP;;454;3;5;3;R$ 3.300.000
5093;Praça Pinheiro da Cunha ; Ipiranga; São Paulo ;174;3;3;4;R$ 900.000
5094;Rua Caixanas, 37738888 ; Jardim Guedala; São Paulo ;551;4;8;6;R$ 5.000.000
5095;Rua Cambará ; Vila Bertioga; São Paulo ;170;3;4;4;R$ 1.050.000
5096;Jardim Leonor, São Paulo ; SP;;550;4;5;4;R$ 3.500.000
5097;Rua Agostinho Gomes ; Ipiranga; São Paulo ;150;2;3;2;R$ 1.020.000
5098;Rua Conselheiro Torres Homem, 285 ; Jardim Paulista; São Paulo ;250;4;5;4;R$ 4.900.000
5099;Rua Groenlândia ; Jardim América; São Paulo ;815;4;8;4;R$ 25.000.000
5100;Jardim Gonzaga, São Paulo ; SP;;378;10;8;8;R$ 950.000
5101;Avenida Professor Fonseca Rodrigues ; Alto de Pinheiros; São Paulo ;566;4;5;4;R$ 8.599.000
5102;Rua Ascânio ; Chácara Mafalda; São Paulo ;180;3;1;2;R$ 586.000
5103;Jardim dos Estados, São Paulo ; SP;;717;4;4;4;"R$ 18.500
                      /Mês"
5104;Avenida Professor Fonseca Rodrigues, 0 ; Alto de Pinheiros; São Paulo ;627;4;6;4;R$ 7.600.000
5105;Vila Madalena, São Paulo ; SP;;170;2;3;2;R$ 1.690.000
5106;Rua Desembargador Teodomiro Dias, 600 ; Conjunto Residencial Butantã; São Paulo ;110;3;1;1;R$ 700.000
5107;Rua Guinle ; Vila Monumento; São Paulo ;198;4;2;3;R$ 1.600.000
5108;Rua Ribeiro do Vale ; Brooklin Paulista; São Paulo ;230;3;2;5;R$ 1.700.000
5109;Rua Mário Barbosa Rodrigues ; Interlagos; São Paulo ;392;4;5;4;R$ 1.700.000
5110;Rua Ponta Porã ; Vila Ipojuca; São Paulo ;220;3;3;3;R$ 1.300.000
5111;Jardim Morumbi, São Paulo ; SP;;617;4;6;8;R$ 3.700.000
5112;Rua Açaré ; Alto de Pinheiros; São Paulo ;212;3;3;3;R$ 2.240.000
5113;Rua Aurora Contieri ; Sumarezinho; São Paulo ;204;3;5;2;R$ 2.000.000
5114;Rua Dona Brígida ; Vila Mariana; São Paulo ;265;4;3;2;R$ 2.200.000
5115;Rua Maria Teresa Assunção, 618 ; Vila São Geraldo; São Paulo ;160;3;3;2;R$ 636.000
5116;Jardim Guedala, São Paulo ; SP;;1452;4;5;14;R$ 16.000.000
5117;Jardim Londrina, São Paulo ; SP;;400;4;5;4;R$ 1.600.000
5118;Rua Visconde de Ourem ; Jardim Aeroporto; São Paulo ;100;2;2;1;R$ 490.000
5119;Rua Chiquinha Rodrigues ; Caxingui; São Paulo ;214;3;3;4;R$ 1.800.000
5120;Rua Péricles ; Jardim Petrópolis; São Paulo ;250;4;6;4;"R$ 12.000
                      /Mês"
5121;Rua Sofia ; Jardim Europa; São Paulo ;350;4;6;3;R$ 5.850.000
5122;Jardim Leonor, São Paulo ; SP;;584;6;7;6;R$ 2.200.000
5123;Rua Diogo Rodrigues Marques ; Campo Grande; São Paulo ;100;3;2;4;R$ 735.000
5124;Rua Gomes Freire ; Lapa; São Paulo ;161;3;2;2;R$ 920.000
5125;Rua Comendador Joaquim Gomes de Oliveira ; Vila São Francisco (Zona Sul); São Paulo ;110;2;2;1;R$ 740.000
5126;Rua Manduri ; Jardim Paulistano; São Paulo ;750;5;8;5;R$ 10.300.000
5127;Rua Alvarenga ; Butantã; São Paulo ;400;4;3;4;"R$ 10.000
                      /Mês"
5128;Rua João Batista Leme da Silva, 115 ; Vila Madalena; São Paulo ;170;3;3;2;R$ 1.500.000
5129;Rua Guaianaz da Fonseca ; Vila Madalena; São Paulo ;220;4;5;4;R$ 1.790.000
5130;Travessa Doutor Adilson Rodrigues, 6 ; Vila Mariana; São Paulo ;140;3;2;1;R$ 660.000
5131;Rua Antilhas ; Jardim América; São Paulo ;600;5;4;8;R$ 12.000.000
5132;Jardim da Saúde, São Paulo ; SP;;200;3;1;2;R$ 1.500.000
5133;Alto de Pinheiros, São Paulo ; SP;;349;4;2;5;R$ 3.500.000
5134;Rua Laerte Assunção, 96 ; Jardim Paulistano; São Paulo ;400;4;6;5;R$ 7.000.000
5135;Rua Doutor Octávio de Oliveira Santos ; Brooklin Paulista; São Paulo ;300;4;5;3;R$ 1.350.000
5136;Vila Cruzeiro, São Paulo ; SP;;165;3;3;3;R$ 1.600.000
5137;Avenida Parada Pinto ; Vila Nova Cachoeirinha; São Paulo ;280;3;3;6;"R$ 4.000
                      /Mês"
5138;Quinta da Paineira, São Paulo ; SP;;260;3;3;3;R$ 720.000
5139;Rua Caropá, 490 ; Vila Madalena; São Paulo ;217;4;5;4;R$ 1.800.000
5140;Rua Tomé Portes ; Brooklin Paulista; São Paulo ;266;4;5;2;R$ 1.500.000
5141;Avenida Padre Pereira de Andrade ; Boaçava; São Paulo ;312;3;4;5;R$ 3.150.000
5142;Rua Plínio Salgado, 167 ; Jardim Peri Peri; São Paulo ;151;2;2;3;R$ 1.500.000
5143;Rua Frederico Von Martius, , 73 ; Vila Monumento; São Paulo ;300;3;5;2;R$ 1.399.900
5144;Jardim América, São Paulo ; SP;;600;3;3;4;"R$ 28.000
                      /Mês"
5145;Rua Amílcar Barbuy ; Parque São Domingos; São Paulo ;180;4;5;3;R$ 1.200.000
5146;Rua Colatino Marques ; Jardim Paulista; São Paulo ;320;3;5;2;"R$ 17.000
                      /Mês"
5147;Rua Almirante Pereira Guimarães ; Pacaembu; São Paulo ;700;5;5;16;R$ 5.897.000
5148;Rua Demóstenes ; Campo Belo; São Paulo ;119;2;2;2;R$ 850.000
5149;Rua Pero Correia, 314 ; Vila Mariana; São Paulo ;296;4;6;3;R$ 1.300.000
5150;Rua Ita ; Vila Santos; São Paulo ;135;3;2;2;R$ 499.000
5151;Rua Ubaíra ; Indianópolis; São Paulo ;200;3;4;4;R$ 1.990.000
5152;Rua Marcelino Champagnat ; Jardim da Glória; São Paulo ;250;4;4;2;R$ 1.600.000
5153;Rua General Manuel Vargas ; Cidade Vargas; São Paulo ;96;3;1;2;R$ 658.000
5154;Perdizes, São Paulo ; SP;;200;3;3;2;R$ 997.000
5155;Chácara Monte Alegre, São Paulo ; SP;;454;3;5;3;R$ 3.300.000
5156;Praça Pinheiro da Cunha ; Ipiranga; São Paulo ;174;3;3;4;R$ 900.000
5157;Rua Caixanas, 37738888 ; Jardim Guedala; São Paulo ;551;4;8;6;R$ 5.000.000
5158;Rua Cambará ; Vila Bertioga; São Paulo ;170;3;4;4;R$ 1.050.000
5159;Jardim Leonor, São Paulo ; SP;;550;4;5;4;R$ 3.500.000
5160;Rua Agostinho Gomes ; Ipiranga; São Paulo ;150;2;3;2;R$ 1.020.000
5161;Rua Conselheiro Torres Homem, 285 ; Jardim Paulista; São Paulo ;250;4;5;4;R$ 4.900.000
5162;Rua Groenlândia ; Jardim América; São Paulo ;815;4;8;4;R$ 25.000.000
5163;Jardim Gonzaga, São Paulo ; SP;;378;10;8;8;R$ 950.000
5164;Rua Dom Tomás Costa e Lima, , 145 ; Vila Tramontano; São Paulo ;388;3;6;5;R$ 4.890.000
5165;Rua Palmares ; Brooklin Paulista; São Paulo ;315;4;5;5;R$ 1.700.000
5166;Vila Madalena, São Paulo ; SP;;223;4;3;3;R$ 1.900.010
5167;Rua Nestor Moreira ; Jardim da Glória; São Paulo ;234;3;1;2;R$ 1.500.000
5168;Liberdade, São Paulo ; SP;;90;3;2;1;R$ 600.000
5169;Rua Amsterdam ; Vila Campestre; São Paulo ;124;3;2;2;R$ 600.000
5170;Jardim Campo Grande, São Paulo ; SP;;190;3;3;4;R$ 1.500.000
5171;Rua Colombo Florence ; Parque Fongaro; São Paulo ;370;3;3;6;R$ 930.000
5172;Rua Geórgia, 2032 ; Brooklin Paulista; São Paulo ;320;4;6;5;"R$ 12.000
                      /Mês"
