;Rua;Bairro;Cidade;area_m2;quartos;banheiros;vagas;price
2410;Instituto de Previdência, São Paulo ; SP;;450;5;5;3;R$ 1.355.010
2411;Caxingui, São Paulo ; SP;;800;4;4;8;"R$ 20.000
                      /Mês"
2412;Rua Catuicara ; Jardim Novo Mundo; São Paulo ;220;4;5;3;R$ 2.700.000
2413;Rua Grécia ; Jardim Europa; São Paulo ;265;5;6;4;R$ 4.800.000
2414;Rua General Fonseca Teles ; Jardim Paulista; São Paulo ;420;3;7;3;R$ 8.700.000
2415;Rua Dom Tomás Costa e Lima ; Vila Tramontano; São Paulo ;600;3;6;8;R$ 4.900.000
2416;Rua Adalívia de Toledo ; Paineiras do Morumbi; São Paulo ;500;4;4;5;R$ 2.500.000
2417;Paineiras do Morumbi, São Paulo ; SP;;815;4;3;4;R$ 3.000.000
2418;Rua Margarida Galvão, 00 ; Paineiras do Morumbi; São Paulo ;580;3;4;6;R$ 4.100.000
2419;Vila Campo Grande, São Paulo ; SP;;229;2;3;1;R$ 420.000
2420;Jardim Ana Maria, São Paulo ; SP;;491;4;5;8;R$ 4.600.000
2421;Rua Thereza Masironi Gonfiantini, 244 ; Vila Nova Alba; São Paulo ;147;3;3;2;R$ 500.000
2422;Vila Nova Caledonia, São Paulo ; SP;;300;4;4;4;R$ 1.600.000
2423;Rua Maracaibo ; Jardim Everest; São Paulo ;600;3;7;6;R$ 4.950.000
2424;Rua Barão do Bananal ; Vila Pompéia; São Paulo ;106;3;2;2;R$ 920.000
2425;Rua Artur de Souza Marques ; Vila Tramontano; São Paulo ;1000;4;5;6;"R$ 25.000
                      /Mês"
2426;Travessa Doutor Ezequiel Antunes de Oliveira ; Vila Nova Conceição; São Paulo ;170;3;4;3;R$ 2.690.000
2427;Vila Madalena, São Paulo ; SP;;330;3;3;2;R$ 5.800.000
2428;Jardim Paulistano, São Paulo ; SP;;748;5;6;6;"R$ 43.000
                      /Mês"
2429;Pacaembu, São Paulo ; SP;;1171;5;7;10;R$ 16.000.000
2430;Campo Belo, São Paulo ; SP;;380;3;4;5;R$ 2.800.000
2431;Rua Abegoaria ; Pinheiros; São Paulo ;686;4;6;6;R$ 5.800.000
2432;Rua Pedro Osório Filho ; Vila Nova Cachoeirinha; São Paulo ;180;3;3;2;R$ 650.000
2433;Jardim Trussardi, São Paulo ; SP;;240;3;4;4;R$ 3.000.000
2434;Alameda dos Guatás ; Saúde; São Paulo ;90;2;4;2;R$ 750.000
2435;Pacaembu, São Paulo ; SP;;520;6;6;5;R$ 2.500.000
2436;Rua Conde de Irajá, 208 ; Vila Mariana; São Paulo ;369;3;1;3;R$ 1.950.000
2437;Rua Professor João Marinho ; Vila Mariana; São Paulo ;165;3;4;2;R$ 1.490.000
2438;Rua Doutor José Maria Whitaker, 0 ; Vila Sônia; São Paulo ;259;3;3;2;R$ 1.500.000
2439;Rua Ulisses Cruz, 106 ; Tatuapé; São Paulo ;117;2;1;1;R$ 495.000
2440;Rua Acruás, 188 ; Vila Congonhas; São Paulo ;158;2;1;2;R$ 1.200.000
2441;Avenida Professor Frederico Herman Júnior ; Alto de Pinheiros; São Paulo ;347;5;5;5;R$ 3.500.000
2442;Rua Vicente Biondo, 216 ; Vila Ester (Zona Norte); São Paulo ;226;3;1;4;R$ 670.000
2443;Rua Caetano José Batista, 202 ; Jardim das Acácias; São Paulo ;150;3;1;2;R$ 691.000
2444;Rua Xavier da Veiga, 109 ; Santana; São Paulo ;300;4;2;4;R$ 1.596.000
2445;Rua Professor Oliveira Fausto, 260 ; Alto da Mooca; São Paulo ;360;4;1;4;R$ 1.600.000
2446;Rua Japuanga, 265 ; Vila Ida; São Paulo ;400;3;1;5;R$ 4.043.000
2447;Rua Simpatia, 81 ; Jardim das Bandeiras; São Paulo ;250;2;1;6;R$ 2.000.000
2448;Rua Baturité, 38 ; Aclimação; São Paulo ;208;3;1;3;R$ 1.383.000
2449;Rua Oscar Caravelas, 60 ; Sumarezinho; São Paulo ;324;6;2;4;R$ 1.800.000
2450;Rua Laurindo de Brito, 468 ; Lapa; São Paulo ;260;3;2;4;R$ 1.200.000
2451;Rua Timbó, 130 ; Mooca; São Paulo ;170;3;1;2;R$ 1.000.000
2452;Rua Frei Juan Auli, 90 ; Jardim Patente; São Paulo ;150;2;3;5;R$ 455.000
2453;Avenida Piassanguaba, 1009 ; Planalto Paulista; São Paulo ;182;3;1;2;R$ 980.000
2454;Rua Boquim ; Vila Ida; São Paulo ;235;3;3;5;R$ 2.500.000
2455;Rua Gil Fernandes, 366 ; Bosque da Saúde; São Paulo ;388;3;4;4;R$ 1.700.000
2456;Morumbi, São Paulo ; SP;;350;4;5;4;"R$ 14.000
                      /Mês"
2457;Rua Gregório Paes de Almeida ; Vila Madalena; São Paulo ;400;4;5;6;R$ 2.490.000
2458;Brooklin Paulista, São Paulo ; SP;;420;4;4;3;R$ 3.000.000
2459;Rua Lourenço Castanho ; Vila Nova Conceição; São Paulo ;177;3;4;3;R$ 2.850.000
2460;Rua Prestes João ; Jardim Luzitânia; São Paulo ;550;2;5;5;R$ 7.000.000
2461;Rua Martins Bonilha, 21 ; Alto da Mooca; São Paulo ;175;6;3;2;R$ 1.300.000
2462;Rua Manuel Navarro ; Jardim Guedala; São Paulo ;595;5;7;5;R$ 5.500.000
2463;Rua Antônio de Gouveia Giudice, 1585 ; Alto de Pinheiros; São Paulo ;483;5;1;4;R$ 5.000.000
2464;Rua Honduras ; Jardim Paulista; São Paulo ;500;4;6;8;R$ 7.000.000
2465;Cidade Jardim, São Paulo ; SP;;450;3;2;4;R$ 3.000.000
2466;Rua Paris ; Sumaré; São Paulo ;150;3;3;2;R$ 1.200.000
2467;Jardim América, São Paulo ; SP;;600;3;5;5;"R$ 12.000
                      /Mês"
2468;Jardim Paulista, São Paulo ; SP;;220;3;5;2;R$ 4.950.000
2469;Rua Pedro Mainente, 108 ; Parque dos Príncipes; São Paulo ;173;3;2;4;R$ 750.000
2470;Alto de Pinheiros, São Paulo ; SP;;340;4;4;4;R$ 4.500.000
2471;Jardim Paulistano, São Paulo ; SP;;700;4;6;2;"R$ 30.000
                      /Mês"
2472;Rua Capital Federal, 799 ; Sumaré; São Paulo ;230;4;2;1;R$ 1.500.000
2473;Boaçava, São Paulo ; SP;;422;5;8;6;R$ 4.500.000
2474;Rua Engenheiro Pedro Garcin, 190 ; Vila Antônio; São Paulo ;110;2;1;2;R$ 480.000
2475;Boaçava, São Paulo ; SP;;327;5;4;4;R$ 3.000.000
2476;Rua Mário Guastini ; Pinheiros; São Paulo ;700;5;7;5;R$ 9.500.000
2477;Rua Domingos Lopes ; Campo Belo; São Paulo ;145;3;3;2;R$ 900.000
2478;Rua Jardim Hollywood ; Santana; São Paulo ;250;4;4;5;R$ 1.750.000
2479;Rua Ática ; Jardim Brasil (Zona Sul); São Paulo ;174;3;4;1;R$ 599.000
2480;Rua Ajurapéia, 65 ; Vila Madalena; São Paulo ;210;3;1;2;R$ 1.050.000
2481;Jardim Leonor, São Paulo ; SP;;491;4;8;4;R$ 3.100.000
2482;Avenida Iraí ; Indianópolis; São Paulo ;420;4;7;4;R$ 1.800.000
2483;Rua Nova Orleans ; Brooklin Paulista; São Paulo ;150;2;3;4;R$ 1.590.000
2484;Rua Maria Teresa Assunção ; Vila São Geraldo; São Paulo ;160;3;3;2;R$ 636.000
2485;Rua Vicente Romano ; Parque da Mooca; São Paulo ;341;4;3;4;R$ 2.300.000
2486;Rua Manuel Galvão ; Mooca; São Paulo ;106;3;3;2;R$ 450.000
2487;Jardim América, São Paulo ; SP;;815;4;6;4;R$ 25.500.000
2488;Jardim Guedala, São Paulo ; SP;;560;4;6;3;R$ 6.800.000
2489;Rua Stefan Marek Neuding, 37738888 ; Jardim Sílvia (Zona Oeste); São Paulo ;1643;4;8;10;R$ 4.495.000
2490;Rua Alemanha ; Jardim Europa; São Paulo ;600;4;4;7;R$ 13.500.000
2491;Rua Kalil Filho, 157 ; Indianópolis; São Paulo ;225;3;2;2;R$ 1.850.000
2492;Rua Pau;Brasil ;;296;3;2;5;R$ 2.750.000
2493;Consolação, São Paulo ; SP;;340;9;5;5;"R$ 21.000
                      /Mês"
2494;Vila Cordeiro, São Paulo ; SP;;200;4;6;4;R$ 3.600.000
2495;Jardim Monte Kemel, São Paulo ; SP;;158;2;1;1;R$ 480.000
2496;Rua David Pimentel ; Fazenda Morumbi; São Paulo ;900;4;8;9;"R$ 35.000
                      /Mês"
2497;Avenida Doutor Cardoso de Melo ; Vila Olímpia; São Paulo ;200;2;3;2;R$ 2.900.000
2498;Rua Abagiba, 495 ; Saúde; São Paulo ;180;2;1;2;R$ 745.000
2499;Boaçava, São Paulo ; SP;;488;5;7;6;R$ 4.250.000
2500;Jardim dos Estados, São Paulo ; SP;;500;4;5;5;R$ 4.900.000
2501;Jardim América, São Paulo ; SP;;1141;5;5;10;"R$ 100.000
                      /Mês"
2502;Rua Benedito Chaves ; Jardim Paulistano; São Paulo ;433;5;4;8;R$ 6.500.000
2503;Jardim Leonor, São Paulo ; SP;;560;4;5;4;R$ 4.750.000
2504;Rua Leopoldo Fróes ; Alto da Mooca; São Paulo ;170;3;3;5;R$ 950.000
2505;Rua Colatino Marques, 214 ; Jardim Paulista; São Paulo ;548;4;6;6;R$ 6.200.000
2506;Rua General Euclides Figueiredo ; Morumbi; São Paulo ;455;4;5;6;R$ 1.580.000
2507;Rua França ; Jardim Europa; São Paulo ;952;3;7;10;R$ 22.000.000
2508;Rua Iraci ; Jardim Paulistano; São Paulo ;250;3;3;3;R$ 2.100.000
2509;Rua General Euclides Figueiredo ; Morumbi; São Paulo ;455;4;5;6;R$ 1.580.000
2510;Rua França ; Jardim Europa; São Paulo ;952;3;7;10;R$ 22.000.000
2511;Rua Iraci ; Jardim Paulistano; São Paulo ;250;3;3;3;R$ 2.100.000
2512;Retiro Morumbi, São Paulo ; SP;;1356;5;12;26;"R$ 15.000
                      /Mês"
2513;Rua Comendador Bichara Moherdauí ; Jardim Leonor; São Paulo ;798;5;7;8;R$ 4.950.000
2514;Alto de Pinheiros, São Paulo ; SP;;380;4;5;5;R$ 5.200.000
2515;Largo Mestre de Aviz ; Jardim Luzitânia; São Paulo ;454;4;6;4;R$ 3.850.000
2516;Rua Macejana, 39 ; Indianópolis; São Paulo ;89;3;1;2;R$ 638.500
2517;Vila São Silvestre, São Paulo ; SP;;168;3;1;4;R$ 900.000
2518;Retiro Morumbi, São Paulo ; SP;;2100;7;14;12;R$ 19.800.000
2519;Rua Escócia ; Pinheiros; São Paulo ;601;4;5;4;R$ 8.500.000
2520;Morumbi, São Paulo ; SP;;713;5;7;8;R$ 4.000.000
2521;Rua Elias Cutait ; Cidade Jardim; São Paulo ;280;3;3;4;"R$ 9.000
                      /Mês"
2522;Rua Monsanto, 62 ; Pinheiros; São Paulo ;420;4;4;6;R$ 2.900.000
2523;Vila Tramontano, São Paulo ; SP;;1650;6;16;42;"R$ 100.000
                      /Mês"
2524;Rua João Bizarro da Nave ; Vila Diva (Zona Leste); São Paulo ;178;3;1;3;R$ 450.000
2525;Vila Ida, São Paulo ; SP;;428;7;6;4;R$ 3.300.000
2526;Jardim América, São Paulo ; SP;;170;2;3;2;R$ 2.300.000
2527;Rua Gustavo Teixeira, 55 ; Pacaembu; São Paulo ;350;3;2;4;R$ 2.700.000
2528;Chácara Tatuapé, São Paulo ; SP;;150;3;2;2;R$ 640.000
2529;Boaçava, São Paulo ; SP;;540;4;5;6;R$ 5.000.000
2530;Rua Sanharó ; Jardim Guedala; São Paulo ;420;3;6;6;R$ 3.500.000
2531;Rua das Fiandeiras, 157 ; Vila Olímpia; São Paulo ;141;2;2;1;R$ 1.500.000
2532;Alto de Pinheiros, São Paulo ; SP;;490;4;6;5;R$ 3.800.000
2533;Jardim Guedala, São Paulo ; SP;;725;3;8;10;"R$ 25.000
                      /Mês"
2534;Vila Ida, São Paulo ; SP;;380;4;5;4;R$ 3.650.000
2535;Alto de Pinheiros, São Paulo ; SP;;510;4;3;5;"R$ 10.000
                      /Mês"
2536;Rua Duartina ; Sumaré; São Paulo ;402;4;4;4;R$ 3.800.000
2537;Rua Manoel Jacinto do Rego ; Vila Romana; São Paulo ;191;3;3;2;R$ 1.150.000
2538;Jardim Leonor, São Paulo ; SP;;621;4;4;15;R$ 6.900.000
2539;Vila Ida, São Paulo ; SP;;462;5;6;6;R$ 5.320.000
2540;Rua Tefé ; Sumaré; São Paulo ;452;3;4;2;R$ 2.300.000
2541;Rua Antônio Splendore ; Interlagos; São Paulo ;280;3;5;8;R$ 2.050.000
2542;Jardim Europa, São Paulo ; SP;;878;4;6;8;R$ 15.499.000
2543;Rua Argentina ; Jardim América; São Paulo ;880;3;5;10;R$ 20.000.000
2544;Rua Vieira de Morais ; Campo Belo; São Paulo ;116;3;2;1;R$ 890.000
2545;Rua Costa Aguiar, 2434 ; Ipiranga; São Paulo ;219;3;1;1;R$ 1.172.000
2546;Avenida das Corujas, 214 ; Sumarezinho; São Paulo ;110;3;1;4;R$ 2.021.300
2547;Planalto Paulista, São Paulo ; SP;;250;4;6;4;R$ 1.915.000
2548;Vila Ida, São Paulo ; SP;;300;4;7;3;"R$ 20.000
                      /Mês"
2549;Rua Ulisses Esteves Costa, 39 ; Santana; São Paulo ;305;3;3;2;R$ 1.700.000
2550;Rua Humberto I, 1046 ; Vila Mariana; São Paulo ;300;3;3;5;R$ 1.800.000
2551;Rua Irmão Gonçalo, 31 ; Jardim das Bandeiras; São Paulo ;810;6;5;8;R$ 5.700.000
2552;Rua Berlioz ; Alto de Pinheiros; São Paulo ;400;4;5;4;"R$ 40.000
                      /Mês"
2553;Jardim Morumbi, São Paulo ; SP;;450;4;7;7;R$ 1.950.000
2554;Lar São Paulo, São Paulo ; SP;;586;4;4;5;R$ 1.680.000
2555;Rua Lauro Freire, 42 ; Jardim Celeste; São Paulo ;120;3;1;2;R$ 638.500
2556;Vila Nova Conceição, São Paulo ; SP;;170;3;5;3;R$ 2.300.000
2557;Jardim Paulista, São Paulo ; SP;;231;2;2;2;R$ 4.570.000
2558;Jardim América, São Paulo ; SP;;650;5;6;4;R$ 6.000.000
2559;Morumbi, São Paulo ; SP;;793;6;6;7;"R$ 16.000
                      /Mês"
2560;Rua Lessing ; Chácara Belenzinho; São Paulo ;90;3;2;1;R$ 452.000
2561;Jardim América, São Paulo ; SP;;440;5;4;5;"R$ 15.000
                      /Mês"
2562;Vila Tramontano, São Paulo ; SP;;465;4;5;4;R$ 3.500.000
2563;Rua Elias Cutait ; Cidade Jardim; São Paulo ;280;3;1;3;R$ 3.500.000
2564;Rua Damiana da Cunha, 70 ; Santa Teresinha; São Paulo ;382;3;1;5;R$ 1.908.000
2565;Rua Cordisburgo ; Jardim Leonor; São Paulo ;550;4;1;6;R$ 3.310.000
2566;Rua Anatólia ; Boaçava; São Paulo ;650;3;5;2;R$ 8.000.000
2567;Rua Demóstenes ; Campo Belo; São Paulo ;253;3;2;4;R$ 1.950.000
2568;Consolação, São Paulo ; SP;;500;6;5;10;"R$ 20.000
                      /Mês"
2569;Avenida Ireré ; Planalto Paulista; São Paulo ;337;3;4;10;R$ 2.150.000
2570;Avenida Itacira ; Planalto Paulista; São Paulo ;361;4;6;4;R$ 2.300.000
2571;Avenida Diógenes Ribeiro de Lima ; Alto de Pinheiros; São Paulo ;190;3;3;5;"R$ 10.000
                      /Mês"
2572;Rua Nigéria ; Itaim Bibi; São Paulo ;197;2;4;3;R$ 2.565.000
2573;Rua Marechal Bitencourt ; Jardim Paulista; São Paulo ;900;5;4;12;R$ 15.000.000
2574;Rua dos Pássaros ; Mooca; São Paulo ;117;3;3;3;R$ 1.277.000
2575;Rua Vespasiano, 556 ; Vila Romana; São Paulo ;550;4;2;6;R$ 2.980.000
2576;Santo Amaro, São Paulo ; SP;;164;4;3;2;R$ 905.000
2577;Jardim Guedala, São Paulo ; SP;;564;6;8;7;"R$ 10.000
                      /Mês"
2578;Rua Fernão Dias, 217 ; Pinheiros; São Paulo ;220;6;2;4;R$ 1.750.000
2579;Vila Madalena, São Paulo ; SP;;250;3;3;3;"R$ 22.000
                      /Mês"
2580;Rua Engenheiro Guimarães Valadão ; Cidade Jardim; São Paulo ;360;4;3;2;"R$ 12.000
                      /Mês"
2581;Rua Doutor Octávio de Oliveira Santos ; Brooklin Paulista; São Paulo ;190;4;3;3;R$ 1.350.000
2582;Jardim Leonor, São Paulo ; SP;;700;5;7;16;"R$ 20.000
                      /Mês"
2583;Rua Jovina ; Vila Mascote; São Paulo ;170;4;4;3;R$ 950.000
2584;Rua Francisco Correia Dutra, 209 ; Jardim Maria Luiza; São Paulo ;94;2;2;2;R$ 429.000
2585;Boaçava, São Paulo ; SP;;383;4;5;9;"R$ 15.000
                      /Mês"
2586;Rua Ytaipu ; Mirandópolis; São Paulo ;200;2;1;2;R$ 915.000
2587;Cidade Jardim, São Paulo ; SP;;1000;4;6;8;R$ 10.000.000
2588;Rua João Lourenço ; Moema; São Paulo ;470;4;4;4;R$ 7.500.000
2589;Pacaembu, São Paulo ; SP;;358;3;5;4;R$ 3.900.000
2590;Jardim Guedala, São Paulo ; SP;;933;4;7;9;R$ 8.600.000
2591;Rua Veneza ; Jardim Paulista; São Paulo ;380;3;3;2;"R$ 15.000
                      /Mês"
2592;Pacaembu, São Paulo ; SP;;950;5;4;10;"R$ 45.000
                      /Mês"
2593;Granja Julieta, São Paulo ; SP;;487;4;4;4;R$ 4.400.000
2594;Planalto Paulista, São Paulo ; SP;;439;4;4;5;R$ 3.900.000
2595;Jardim Paulistano, São Paulo ; SP;;250;3;3;3;R$ 2.100.000
2596;Vila Tramontano, São Paulo ; SP;;580;4;6;6;R$ 2.900.000
2597;Boaçava, São Paulo ; SP;;419;3;5;4;R$ 4.800.000
2598;Rua General Sena Vasconcelos ; Jardim Guedala; São Paulo ;500;4;3;5;R$ 2.500.000
2599;Jardim Europa, São Paulo ; SP;;400;5;2;4;R$ 8.790.000
2600;Rua Principado de Mônaco ; Pacaembu; São Paulo ;360;4;5;3;R$ 3.100.000
2601;Rua Caucaia do Alto ; Vila Albertina; São Paulo ;497;3;3;5;R$ 920.000
2602;Instituto de Previdência, São Paulo ; SP;;306;4;4;3;R$ 1.790.000
2603;Rua Cuxiponês ; Jardim Vera Cruz; São Paulo ;160;3;2;3;R$ 1.350.000
2604;Rua Alemanha ; Jardim Europa; São Paulo ;551;3;5;3;R$ 7.700.000
2605;Real Parque, São Paulo ; SP;;450;5;6;4;R$ 3.600.000
2606;Jardim Guedala, São Paulo ; SP;;1080;5;9;10;"R$ 25.000
                      /Mês"
2607;Rua Antônio Mariani ; Instituto de Previdência; São Paulo ;326;3;5;2;R$ 1.050.000
2608;Rua Grécia ; Jardim Europa; São Paulo ;650;5;5;4;R$ 10.000.000
2609;Instituto de Previdência, São Paulo ; SP;;245;3;4;4;R$ 990.000
2610;Rua José Ferreira da Rocha Filho ; Jardim Monte Kemel; São Paulo ;130;3;4;2;R$ 775.000
2611;Rua Apeu ; Vila Brasílio Machado; São Paulo ;293;4;6;3;R$ 2.500.000
2612;Alto de Pinheiros, São Paulo ; SP;;800;4;6;11;"R$ 37.000
                      /Mês"
2613;Avenida Amarilis ; Cidade Jardim; São Paulo ;661;4;7;8;R$ 5.900.000
2614;Rua Inocêncio Nogueira ; Cidade Jardim; São Paulo ;727;6;2;7;R$ 5.800.000
2615;Avenida Ceci ; Planalto Paulista; São Paulo ;350;4;4;3;R$ 2.500.000
2616;Butantã, São Paulo ; SP;;500;5;4;5;"R$ 22.500
                      /Mês"
2617;Rua Aperca, 409 ; Boaçava; São Paulo ;1074;4;4;6;R$ 8.000.000
2618;Rua Pirapó ; Jardim Guedala; São Paulo ;550;4;6;8;R$ 4.200.000
2619;Rua dos Otonis, 289 ; Vila Clementino; São Paulo ;220;4;2;7;R$ 2.350.000
2620;Brooklin Paulista, São Paulo ; SP;;116;3;4;2;R$ 850.000
2621;Vila Madalena, São Paulo ; SP;;337;3;3;4;R$ 5.800.000
2622;Rua Francisco Riva ; Conjunto Habitacional Barreira Grande; São Paulo ;132;3;1;2;R$ 350.000
2623;Paineiras do Morumbi, São Paulo ; SP;;800;6;7;9;"R$ 35.000
                      /Mês"
2624;Rua Marambá, 35 ; Água Fria; São Paulo ;200;4;4;5;R$ 1.270.000
2625;Rua Ytaipu, 489 ; Mirandópolis; São Paulo ;270;4;3;3;R$ 1.790.000
2626;Rua José Vicente de Azevedo ; Vila Mariana; São Paulo ;240;3;4;6;R$ 1.900.000
2627;Rua Jati ; Planalto Paulista; São Paulo ;289;3;4;2;R$ 1.500.000
2628;Cidade Domitila, São Paulo ; SP;;300;3;4;4;"R$ 4.000
                      /Mês"
2629;Rua Juréia, 355 ; Chácara Inglesa; São Paulo ;125;2;1;2;R$ 851.000
2630;Rua Tomé Portes, 555 ; Brooklin Paulista; São Paulo ;480;4;4;3;R$ 1.900.000
2631;Rua Abegoaria ; Jardim das Bandeiras; São Paulo ;686;4;8;6;R$ 4.990.000
2632;Jardim Morumbi, São Paulo ; SP;;700;4;5;6;"R$ 22.000
                      /Mês"
2633;Rua Ceará, 142 ; Consolação; São Paulo ;477;4;6;4;"R$ 30.000
                      /Mês"
2634;Jardim Europa, São Paulo ; SP;;230;3;4;2;R$ 2.700.000
2635;Rua Tomás Lopes Ferreira ; Parque São Domingos; São Paulo ;240;3;3;5;R$ 900.000
2636;Rua Padre Raposo ; Mooca; São Paulo ;135;2;3;2;R$ 692.000
2637;Rua dos Macunis ; Vila Madalena; São Paulo ;300;3;4;4;"R$ 19.000
                      /Mês"
2638;Sumarezinho, São Paulo ; SP;;251;4;2;4;R$ 1.700.000
2639;Rua Leandro de Carvalho ; Vila Monumento; São Paulo ;200;3;5;1;R$ 1.030.000
2640;Rua Porangaba ; Bosque da Saúde; São Paulo ;172;2;3;4;R$ 930.000
2641;Rua Ministro Eduardo de Campos Maia, 123 ; Jardim Bonfiglioli; São Paulo ;170;3;3;3;R$ 1.100.000
2642;Vila Madalena, São Paulo ; SP;;379;2;3;3;"R$ 24.000
                      /Mês"
2643;Jardim Paulista, São Paulo ; SP;;420;3;4;3;R$ 9.200.000
2644;Butantã, São Paulo ; SP;;233;4;6;4;"R$ 14.000
                      /Mês"
2645;Rua Bento de Faria, 220 ; Bosque da Saúde; São Paulo ;500;5;8;7;R$ 2.780.000
2646;Rua São Samuel ; Vila Mariana; São Paulo ;500;4;3;5;R$ 4.000.000
2647;Alameda dos Guainumbis ; Planalto Paulista; São Paulo ;600;4;4;6;"R$ 10.000
                      /Mês"
2648;Avenida Morumbi ; Morumbi; São Paulo ;680;3;5;6;R$ 2.500.000
2649;Jardim Guedala, São Paulo ; SP;;900;4;6;10;R$ 6.500.000
2650;Jardim Everest, São Paulo ; SP;;700;5;5;5;"R$ 26.000
                      /Mês"
2651;Alto de Pinheiros, São Paulo ; SP;;670;5;7;7;R$ 15.000.000
2652;Rua Tuiucuê ; Jardim da Saúde; São Paulo ;450;6;7;4;R$ 1.800.000
2653;Rua Antônio Peres Mulla ; Vila Carrão; São Paulo ;85;3;2;1;R$ 480.000
2654;Rua Montevidéu, 00 ; Bela Aliança; São Paulo ;298;3;4;5;R$ 2.490.000
2655;Rua Managua ; Jardim Everest; São Paulo ;956;5;7;6;"R$ 50.000
                      /Mês"
2656;Rua Acarapé, 364 ; Chácara Inglesa; São Paulo ;400;3;3;2;R$ 1.385.000
2657;Rua Rubi, 76 ; Vila do Encontro; São Paulo ;395;4;2;3;R$ 2.400.000
2658;Rua Asfaltite, 63 ; Vila Formosa; São Paulo ;120;2;3;1;R$ 580.000
2659;Rua Guapiaçu ; Vila Clementino; São Paulo ;250;2;2;1;R$ 800.000
2660;Rua Doutor João Pinheiro ; Jardim Paulista; São Paulo ;450;3;4;2;R$ 5.700.000
2661;Rua Doutor Carlos Norberto de Souza Aranha ; Alto de Pinheiros; São Paulo ;379;4;6;5;R$ 4.787.000
2662;Jardim Guedala, São Paulo ; SP;;335;3;3;4;R$ 2.800.000
2663;Rua Enrico de Martino ; Jardim Leonor; São Paulo ;750;4;7;8;R$ 4.500.000
2664;Alto de Pinheiros, São Paulo ; SP;;413;4;7;4;R$ 5.300.000
2665;Rua José de Cristo Moreira ; Vila Morumbi; São Paulo ;525;4;6;4;R$ 2.950.000
2666;Jardim Cordeiro, São Paulo ; SP;;850;4;6;6;R$ 7.500.000
2667;Rua Raul de Morais Vítor, 120 ; Vila Albertina; São Paulo ;150;5;6;2;R$ 498.000
2668;Jardim Leonor, São Paulo ; SP;;875;4;7;6;R$ 5.000.000
2669;Rua Bacopari ; Boaçava; São Paulo ;419;3;4;4;R$ 4.800.000
2670;Alameda Sorimãs ; Planalto Paulista; São Paulo ;380;3;5;3;R$ 1.700.000
2671;Jardim Europa, São Paulo ; SP;;953;3;7;10;R$ 22.000.000
2672;Vila Ida, São Paulo ; SP;;234;3;5;5;R$ 2.350.000
2673;Jardim Vila Mariana, São Paulo ; SP;;160;3;4;4;R$ 1.100.000
2674;Rua Ernesto Nazaré, 762 ; Alto de Pinheiros; São Paulo ;480;4;5;7;R$ 3.900.000
2675;Jardim Paulista, São Paulo ; SP;;180;3;2;1;R$ 3.000.000
2676;Alto de Pinheiros, São Paulo ; SP;;520;3;3;4;R$ 5.300.000
2677;Rua Boa Esperança do Sul, 57 ; Jardim Guedala; São Paulo ;406;4;4;3;R$ 2.700.000
2678;Rua Joaquim Nabuco ; Brooklin Paulista; São Paulo ;278;4;6;3;R$ 2.500.000
2679;Alto de Pinheiros, São Paulo ; SP;;340;5;4;4;R$ 2.540.000
2680;Jardim Guedala, São Paulo ; SP;;681;2;3;6;R$ 2.300.000
2681;Rua Aperca ; Boaçava; São Paulo ;944;5;8;8;R$ 8.000.000
2682;Rua Araporé, 209 ; Jardim Guedala; São Paulo ;431;4;5;6;R$ 4.000.000
2683;Jardim das Bandeiras, São Paulo ; SP;;450;3;4;3;R$ 3.850.000
2684;Jardim Leonor, São Paulo ; SP;;463;4;6;4;R$ 3.950.000
2685;Boaçava, São Paulo ; SP;;376;4;5;4;R$ 3.400.000
2686;Alameda dos Indígenas ; Planalto Paulista; São Paulo ;300;3;4;4;R$ 1.500.000
2687;Rua Domingos Nogueira, 137 ; Jardim Dracena; São Paulo ;173;2;3;4;R$ 445.000
2688;Jardim Leonor, São Paulo ; SP;;1000;5;7;4;R$ 8.000.000
2689;Rua Murajuba ; Alto de Pinheiros; São Paulo ;530;4;4;8;R$ 5.200.000
2690;Avenida Antônio Joaquim de Moura Andrade ; Vila Nova Conceição; São Paulo ;434;5;6;5;"R$ 45.000
                      /Mês"
2691;Rua Valdomiro Lobo da Costa ; Vila das Mercês; São Paulo ;250;3;5;5;R$ 1.100.000
2692;Jardim Paulista, São Paulo ; SP;;425;3;4;5;R$ 9.800.000
2693;Rua das Fiandeiras ; Vila Olímpia; São Paulo ;155;2;3;2;R$ 2.700.000
2694;Rua Dom Sebastião do Rego, 339 ; Vila Gumercindo; São Paulo ;206;3;1;1;R$ 800.000
2695;Rua Tibiriçá ; Brooklin; São Paulo ;700;4;6;6;R$ 3.900.000
2696;Jardim Paulistano, São Paulo ; SP;;934;5;4;14;R$ 14.000.000
2697;Rua Benedetto Bonfigli ; Casa Verde Alta; São Paulo ;102;3;2;2;R$ 479.000
2698;Jardim Europa, São Paulo ; SP;;700;3;5;6;R$ 18.000.000
2699;Jardim Europa, São Paulo ; SP;;482;4;5;5;R$ 9.000.000
2700;Rua Maniutuba ; Chácara Santo Antônio (Zona Leste); São Paulo ;123;2;1;1;R$ 1.100.000
2701;Rua Euclides Pacheco ; Vila Gomes Cardim; São Paulo ;493;4;7;8;"R$ 15.000
                      /Mês"
2702;Rua Narciso Freitas Vieira ; Jardim dos Cataldis; São Paulo ;110;3;1;2;R$ 328.900
2703;Rua Pedro Doll, 99 ; Santana; São Paulo ;100;2;2;1;R$ 590.000
2704;Rua Hermógenes Almeida Prado ; Jardim Guedala; São Paulo ;607;4;5;5;R$ 3.150.000
2705;Cidade Jardim, São Paulo ; SP;;768;6;3;7;R$ 5.800.000
2706;Rua Olegário Mariano ; Jardim Guedala; São Paulo ;840;4;8;6;R$ 8.300.000
2707;Sumaré, São Paulo ; SP;;450;4;7;3;"R$ 15.000
                      /Mês"
2708;Rua Caraúna ; Vila Madalena; São Paulo ;352;5;5;2;"R$ 16.000
                      /Mês"
2709;Rua Coronel Luís Alves ; Vila Mariana; São Paulo ;300;3;3;2;R$ 1.700.000
2710;Jardim Paulista, São Paulo ; SP;;380;5;5;8;R$ 4.990.000
2711;Travessa André Gelly ; Vila Regente Feijó; São Paulo ;200;3;4;2;R$ 650.000
2712;Rua Vicente da Costa ; Ipiranga; São Paulo ;140;3;3;3;R$ 850.000
2713;Chácara Monte Alegre, São Paulo ; SP;;915;4;8;6;"R$ 30.000
                      /Mês"
2714;Rua Anésio Pinto Rosa ; Brooklin Paulista; São Paulo ;286;6;4;4;R$ 3.000.000
2715;Rua Dalton ; Alto da Lapa; São Paulo ;237;3;4;2;R$ 1.950.000
2716;Rua Grajaú ; Sumaré; São Paulo ;250;3;4;2;R$ 2.790.000
2717;Jardim Panorama D'Oeste, São Paulo ; SP;;370;4;4;4;R$ 4.350.000
2718;Jardim Paulista, São Paulo ; SP;;673;3;5;5;R$ 14.700.000
2719;Jardim Paulistano, São Paulo ; SP;;934;6;6;7;R$ 14.000.000
2720;Rua Noruega ; Jardim Europa; São Paulo ;878;4;6;8;R$ 15.500.000
2721;Vila Nova Conceição, São Paulo ; SP;;115;2;2;1;R$ 1.700.000
2722;Pacaembu, São Paulo ; SP;;455;4;5;11;"R$ 12.000
                      /Mês"
2723;Rua Raul Adalberto de Campos ; Vila Madalena; São Paulo ;350;3;4;2;"R$ 10.000
                      /Mês"
2724;Rua Justiniano Serpa ; Lar São Paulo; São Paulo ;156;3;3;4;R$ 960.000
2725;Rua Sofia ; Jardim Europa; São Paulo ;500;4;6;4;R$ 15.000.000
2726;Rua Cônego Eugênio Leite ; Pinheiros; São Paulo ;354;3;4;5;R$ 5.300.000
2727;Jardim Europa, São Paulo ; SP;;725;3;5;7;R$ 22.000.000
2728;Rua Mesquita ; Vila Deodoro; São Paulo ;250;3;5;7;R$ 1.800.000
2729;Vila Suzana, São Paulo ; SP;;240;4;4;6;R$ 1.000.000
2730;Rua Quirino Pucca ; Vila Romana; São Paulo ;80;1;1;2;R$ 480.000
2731;Rua Doutor José de Moura Resende, 266 ; Caxingui; São Paulo ;277;3;3;5;R$ 1.800.000
2732;Rua Valdir Niemeyer ; Sumaré; São Paulo ;230;2;5;2;R$ 2.900.000
2733;Rua Joaquim Nabuco ; Brooklin; São Paulo ;600;3;5;12;R$ 3.000.000
2734;Alameda Franca, 587 ; Jardim Paulista; São Paulo ;137;9;2;1;R$ 2.600.000
2735;Santa Cecília, São Paulo ; SP;;450;4;3;1;R$ 5.850.000
2736;Avenida Professor Ciro de Barros Resende ; Planalto Paulista; São Paulo ;280;4;5;4;R$ 3.750.000
2737;Rua Brumado ; Jardim Maracanã; São Paulo ;280;2;4;8;R$ 650.000
2738;Pacaembu, São Paulo ; SP;;890;4;7;7;R$ 4.600.000
2739;Boaçava, São Paulo ; SP;;435;4;6;6;R$ 4.500.000
2740;Rua Conselheiro Zacarias, 50 ; Jardim Paulista; São Paulo ;580;4;4;3;R$ 9.000.000
2741;Jardim Europa, São Paulo ; SP;;166;4;5;2;R$ 5.400.000
2742;Rua Rosário do Sul, 0 ; Jardim Maringá; São Paulo ;274;3;4;6;R$ 1.050.000
2743;Boaçava, São Paulo ; SP;;350;3;5;7;R$ 5.500.000
2744;Rua Doutor Rafael Caramuru Lanzelloti, 77 ; Aclimação; São Paulo ;200;2;1;1;R$ 850.000
2745;Viela Um, 289 ; Jardim Peri; São Paulo ;320;3;2;4;R$ 1.700.000
2746;Jardim Guedala, São Paulo ; SP;;547;3;4;3;R$ 2.500.000
2747;Perdizes, São Paulo ; SP;;280;4;3;2;R$ 1.750.000
2748;Vila Olímpia, São Paulo ; SP;;160;3;4;3;R$ 2.900.000
2749;Cidade Jardim, São Paulo ; SP;;1530;5;5;30;"R$ 90.000
                      /Mês"
2750;Rua Iraci ; Jardim Paulistano; São Paulo ;240;5;3;2;R$ 2.580.000
2751;Rua Passo da Pátria ; Bela Aliança; São Paulo ;156;3;3;2;R$ 1.000.000
2752;Rua Raul Devesa ; Perdizes; São Paulo ;113;2;2;2;R$ 890.000
2753;Vila Ida, São Paulo ; SP;;456;4;7;4;R$ 4.500.000
